<?xml version="1.0" encoding="utf-8"?>

<feed xmlns="http://www.w3.org/2005/Atom">
<title>RecentChanges</title>
<link href="/blog/recentchanges/"/>
<link href="/blog/recentchanges/index.atom" rel="self" type="application/atom+xml"/>
<author>

<name>Rogério Brito's Digital Junkyard</name>

</author>




<id>/blog/recentchanges/</id>

<subtitle type="html">Rogério Brito&#39;s Digital Junkyard</subtitle>
<generator uri="http://ikiwiki.info/" version="3.20101112">ikiwiki</generator>
<updated>2010-11-12T14:59:50Z</updated>
<entry>
	<title>change to posts/packaging-fonts-for-a-debian-based-system on Rog&#xE9;rio Brito&#x27;s Digital Junkyard</title>

	<id>/blog/recentchanges/change_50292f5364f601ef501cf9bee920ae1b4e07d4c3/</id>

	<link href="/blog/recentchanges/#change-50292f5364f601ef501cf9bee920ae1b4e07d4c3"/>

	<author><name>rbrito</name></author>





	<updated>2010-11-12T14:59:50Z</updated>
	<published>2010-11-12T14:59:50Z</published>

	<content type="html" xml:lang="en">
	





&lt;div id=&quot;change-50292f5364f601ef501cf9bee920ae1b4e07d4c3&quot; class=&quot;metadata&quot;&gt;
&lt;span class=&quot;desc&quot;&gt;&lt;br /&gt;Changed pages:&lt;/span&gt;
&lt;span class=&quot;pagelinks&quot;&gt;

posts/packaging-fonts-for-a-debian-based-system

&lt;/span&gt;
&lt;span class=&quot;desc&quot;&gt;&lt;br /&gt;Changed by:&lt;/span&gt;
&lt;span class=&quot;committer&quot;&gt;

rbrito

&lt;/span&gt;
&lt;span class=&quot;desc&quot;&gt;&lt;br /&gt;Commit type:&lt;/span&gt;
&lt;span class=&quot;committype&quot;&gt;git&lt;/span&gt;
&lt;span class=&quot;desc&quot;&gt;&lt;br /&gt;Date:&lt;/span&gt;
&lt;span class=&quot;changedate&quot;&gt;&lt;span class=&quot;date&quot;&gt;12:59:50 PM 11/12/2010&lt;/span&gt;&lt;/span&gt;
&lt;span class=&quot;desc&quot;&gt;&lt;br /&gt;&lt;/span&gt;
&lt;/div&gt;

&lt;div class=&quot;changelog&quot;&gt;


Add post regarding packaged fonts&lt;br /&gt;


&lt;/div&gt;



	</content>



</entry>
<entry>
	<title>change to posts/first_post on Rog&#xE9;rio Brito&#x27;s Digital Junkyard</title>

	<id>/blog/recentchanges/change_0d5925b3a6a57a4e6926f91521292a21b22fdc07/</id>

	<link href="/blog/recentchanges/#change-0d5925b3a6a57a4e6926f91521292a21b22fdc07"/>

	<author><name>rbrito</name></author>





	<updated>2010-11-10T09:36:34Z</updated>
	<published>2010-11-10T09:36:34Z</published>

	<content type="html" xml:lang="en">
	





&lt;div id=&quot;change-0d5925b3a6a57a4e6926f91521292a21b22fdc07&quot; class=&quot;metadata&quot;&gt;
&lt;span class=&quot;desc&quot;&gt;&lt;br /&gt;Changed pages:&lt;/span&gt;
&lt;span class=&quot;pagelinks&quot;&gt;

posts/first post

&lt;/span&gt;
&lt;span class=&quot;desc&quot;&gt;&lt;br /&gt;Changed by:&lt;/span&gt;
&lt;span class=&quot;committer&quot;&gt;

rbrito

&lt;/span&gt;
&lt;span class=&quot;desc&quot;&gt;&lt;br /&gt;Commit type:&lt;/span&gt;
&lt;span class=&quot;committype&quot;&gt;git&lt;/span&gt;
&lt;span class=&quot;desc&quot;&gt;&lt;br /&gt;Date:&lt;/span&gt;
&lt;span class=&quot;changedate&quot;&gt;&lt;span class=&quot;date&quot;&gt;07:36:34 AM 11/10/2010&lt;/span&gt;&lt;/span&gt;
&lt;span class=&quot;desc&quot;&gt;&lt;br /&gt;&lt;/span&gt;
&lt;/div&gt;

&lt;div class=&quot;changelog&quot;&gt;


Remove example of posting&lt;br /&gt;


&lt;/div&gt;



	</content>



</entry>
<entry>
	<title>change to archives/2000 archives/2000/01 archives/2000/02 archives/2000/03 archives/2000/04 archives/2000/05 archives/2000/06 archives/2000/07 archives/2000/08 archives/2000/09  on Rog&#xE9;rio Brito&#x27;s Digital Junkyard</title>

	<id>/blog/recentchanges/change_404674cadcb70228a7d58921da135a4ad2a72a99/</id>

	<link href="/blog/recentchanges/#change-404674cadcb70228a7d58921da135a4ad2a72a99"/>

	<author><name>rbrito</name></author>





	<updated>2010-10-08T17:13:46Z</updated>
	<published>2010-10-08T17:13:46Z</published>

	<content type="html" xml:lang="en">
	





&lt;div id=&quot;change-404674cadcb70228a7d58921da135a4ad2a72a99&quot; class=&quot;metadata&quot;&gt;
&lt;span class=&quot;desc&quot;&gt;&lt;br /&gt;Changed pages:&lt;/span&gt;
&lt;span class=&quot;pagelinks&quot;&gt;

archives/2000

archives/2000/01

archives/2000/02

archives/2000/03

archives/2000/04

archives/2000/05

archives/2000/06

archives/2000/07

archives/2000/08

archives/2000/09

...

&lt;/span&gt;
&lt;span class=&quot;desc&quot;&gt;&lt;br /&gt;Changed by:&lt;/span&gt;
&lt;span class=&quot;committer&quot;&gt;

rbrito

&lt;/span&gt;
&lt;span class=&quot;desc&quot;&gt;&lt;br /&gt;Commit type:&lt;/span&gt;
&lt;span class=&quot;committype&quot;&gt;git&lt;/span&gt;
&lt;span class=&quot;desc&quot;&gt;&lt;br /&gt;Date:&lt;/span&gt;
&lt;span class=&quot;changedate&quot;&gt;&lt;span class=&quot;date&quot;&gt;02:13:46 PM 10/08/2010&lt;/span&gt;&lt;/span&gt;
&lt;span class=&quot;desc&quot;&gt;&lt;br /&gt;&lt;/span&gt;
&lt;/div&gt;

&lt;div class=&quot;changelog&quot;&gt;


calendar update&lt;br /&gt;


&lt;/div&gt;



	</content>



</entry>
<entry>
	<title>change to tags/multimedia on Rog&#xE9;rio Brito&#x27;s Digital Junkyard</title>

	<id>/blog/recentchanges/change_535ba4e25b3f3cfb6b67a53c28d81160d8e6bedf/</id>

	<link href="/blog/recentchanges/#change-535ba4e25b3f3cfb6b67a53c28d81160d8e6bedf"/>

	<author><name>rbrito</name></author>





	<updated>2010-10-08T17:13:25Z</updated>
	<published>2010-10-08T17:13:25Z</published>

	<content type="html" xml:lang="en">
	





&lt;div id=&quot;change-535ba4e25b3f3cfb6b67a53c28d81160d8e6bedf&quot; class=&quot;metadata&quot;&gt;
&lt;span class=&quot;desc&quot;&gt;&lt;br /&gt;Changed pages:&lt;/span&gt;
&lt;span class=&quot;pagelinks&quot;&gt;

tags/multimedia

&lt;/span&gt;
&lt;span class=&quot;desc&quot;&gt;&lt;br /&gt;Changed by:&lt;/span&gt;
&lt;span class=&quot;committer&quot;&gt;

rbrito

&lt;/span&gt;
&lt;span class=&quot;desc&quot;&gt;&lt;br /&gt;Commit type:&lt;/span&gt;
&lt;span class=&quot;committype&quot;&gt;git&lt;/span&gt;
&lt;span class=&quot;desc&quot;&gt;&lt;br /&gt;Date:&lt;/span&gt;
&lt;span class=&quot;changedate&quot;&gt;&lt;span class=&quot;date&quot;&gt;02:13:25 PM 10/08/2010&lt;/span&gt;&lt;/span&gt;
&lt;span class=&quot;desc&quot;&gt;&lt;br /&gt;&lt;/span&gt;
&lt;/div&gt;

&lt;div class=&quot;changelog&quot;&gt;


creating tag page tags/multimedia&lt;br /&gt;


&lt;/div&gt;



	</content>



</entry>
<entry>
	<title>change to tags/video on Rog&#xE9;rio Brito&#x27;s Digital Junkyard</title>

	<id>/blog/recentchanges/change_06bc0a095508be642583e531e6e4d86911bbaf39/</id>

	<link href="/blog/recentchanges/#change-06bc0a095508be642583e531e6e4d86911bbaf39"/>

	<author><name>rbrito</name></author>





	<updated>2010-10-08T17:13:25Z</updated>
	<published>2010-10-08T17:13:25Z</published>

	<content type="html" xml:lang="en">
	





&lt;div id=&quot;change-06bc0a095508be642583e531e6e4d86911bbaf39&quot; class=&quot;metadata&quot;&gt;
&lt;span class=&quot;desc&quot;&gt;&lt;br /&gt;Changed pages:&lt;/span&gt;
&lt;span class=&quot;pagelinks&quot;&gt;

tags/video

&lt;/span&gt;
&lt;span class=&quot;desc&quot;&gt;&lt;br /&gt;Changed by:&lt;/span&gt;
&lt;span class=&quot;committer&quot;&gt;

rbrito

&lt;/span&gt;
&lt;span class=&quot;desc&quot;&gt;&lt;br /&gt;Commit type:&lt;/span&gt;
&lt;span class=&quot;committype&quot;&gt;git&lt;/span&gt;
&lt;span class=&quot;desc&quot;&gt;&lt;br /&gt;Date:&lt;/span&gt;
&lt;span class=&quot;changedate&quot;&gt;&lt;span class=&quot;date&quot;&gt;02:13:25 PM 10/08/2010&lt;/span&gt;&lt;/span&gt;
&lt;span class=&quot;desc&quot;&gt;&lt;br /&gt;&lt;/span&gt;
&lt;/div&gt;

&lt;div class=&quot;changelog&quot;&gt;


creating tag page tags/video&lt;br /&gt;


&lt;/div&gt;



	</content>



</entry>
<entry>
	<title>change to tags/embedded on Rog&#xE9;rio Brito&#x27;s Digital Junkyard</title>

	<id>/blog/recentchanges/change_cbf78f5d34d1502c570f1aa24a3a09ee2739bad9/</id>

	<link href="/blog/recentchanges/#change-cbf78f5d34d1502c570f1aa24a3a09ee2739bad9"/>

	<author><name>rbrito</name></author>





	<updated>2010-10-08T17:13:25Z</updated>
	<published>2010-10-08T17:13:25Z</published>

	<content type="html" xml:lang="en">
	





&lt;div id=&quot;change-cbf78f5d34d1502c570f1aa24a3a09ee2739bad9&quot; class=&quot;metadata&quot;&gt;
&lt;span class=&quot;desc&quot;&gt;&lt;br /&gt;Changed pages:&lt;/span&gt;
&lt;span class=&quot;pagelinks&quot;&gt;

tags/embedded

&lt;/span&gt;
&lt;span class=&quot;desc&quot;&gt;&lt;br /&gt;Changed by:&lt;/span&gt;
&lt;span class=&quot;committer&quot;&gt;

rbrito

&lt;/span&gt;
&lt;span class=&quot;desc&quot;&gt;&lt;br /&gt;Commit type:&lt;/span&gt;
&lt;span class=&quot;committype&quot;&gt;git&lt;/span&gt;
&lt;span class=&quot;desc&quot;&gt;&lt;br /&gt;Date:&lt;/span&gt;
&lt;span class=&quot;changedate&quot;&gt;&lt;span class=&quot;date&quot;&gt;02:13:25 PM 10/08/2010&lt;/span&gt;&lt;/span&gt;
&lt;span class=&quot;desc&quot;&gt;&lt;br /&gt;&lt;/span&gt;
&lt;/div&gt;

&lt;div class=&quot;changelog&quot;&gt;


creating tag page tags/embedded&lt;br /&gt;


&lt;/div&gt;



	</content>



</entry>
<entry>
	<title>change to tags/libraries on Rog&#xE9;rio Brito&#x27;s Digital Junkyard</title>

	<id>/blog/recentchanges/change_17cc6605ee1d375e2880abfcb392db783eb89dc4/</id>

	<link href="/blog/recentchanges/#change-17cc6605ee1d375e2880abfcb392db783eb89dc4"/>

	<author><name>rbrito</name></author>





	<updated>2010-10-08T17:13:25Z</updated>
	<published>2010-10-08T17:13:25Z</published>

	<content type="html" xml:lang="en">
	





&lt;div id=&quot;change-17cc6605ee1d375e2880abfcb392db783eb89dc4&quot; class=&quot;metadata&quot;&gt;
&lt;span class=&quot;desc&quot;&gt;&lt;br /&gt;Changed pages:&lt;/span&gt;
&lt;span class=&quot;pagelinks&quot;&gt;

tags/libraries

&lt;/span&gt;
&lt;span class=&quot;desc&quot;&gt;&lt;br /&gt;Changed by:&lt;/span&gt;
&lt;span class=&quot;committer&quot;&gt;

rbrito

&lt;/span&gt;
&lt;span class=&quot;desc&quot;&gt;&lt;br /&gt;Commit type:&lt;/span&gt;
&lt;span class=&quot;committype&quot;&gt;git&lt;/span&gt;
&lt;span class=&quot;desc&quot;&gt;&lt;br /&gt;Date:&lt;/span&gt;
&lt;span class=&quot;changedate&quot;&gt;&lt;span class=&quot;date&quot;&gt;02:13:25 PM 10/08/2010&lt;/span&gt;&lt;/span&gt;
&lt;span class=&quot;desc&quot;&gt;&lt;br /&gt;&lt;/span&gt;
&lt;/div&gt;

&lt;div class=&quot;changelog&quot;&gt;


creating tag page tags/libraries&lt;br /&gt;


&lt;/div&gt;



	</content>



</entry>
<entry>
	<title>change to tags/emacs on Rog&#xE9;rio Brito&#x27;s Digital Junkyard</title>

	<id>/blog/recentchanges/change_aa89e9ec5ee59522037d0c77e520b31a6ef8cdac/</id>

	<link href="/blog/recentchanges/#change-aa89e9ec5ee59522037d0c77e520b31a6ef8cdac"/>

	<author><name>rbrito</name></author>





	<updated>2010-10-08T17:13:25Z</updated>
	<published>2010-10-08T17:13:25Z</published>

	<content type="html" xml:lang="en">
	





&lt;div id=&quot;change-aa89e9ec5ee59522037d0c77e520b31a6ef8cdac&quot; class=&quot;metadata&quot;&gt;
&lt;span class=&quot;desc&quot;&gt;&lt;br /&gt;Changed pages:&lt;/span&gt;
&lt;span class=&quot;pagelinks&quot;&gt;

tags/emacs

&lt;/span&gt;
&lt;span class=&quot;desc&quot;&gt;&lt;br /&gt;Changed by:&lt;/span&gt;
&lt;span class=&quot;committer&quot;&gt;

rbrito

&lt;/span&gt;
&lt;span class=&quot;desc&quot;&gt;&lt;br /&gt;Commit type:&lt;/span&gt;
&lt;span class=&quot;committype&quot;&gt;git&lt;/span&gt;
&lt;span class=&quot;desc&quot;&gt;&lt;br /&gt;Date:&lt;/span&gt;
&lt;span class=&quot;changedate&quot;&gt;&lt;span class=&quot;date&quot;&gt;02:13:25 PM 10/08/2010&lt;/span&gt;&lt;/span&gt;
&lt;span class=&quot;desc&quot;&gt;&lt;br /&gt;&lt;/span&gt;
&lt;/div&gt;

&lt;div class=&quot;changelog&quot;&gt;


creating tag page tags/emacs&lt;br /&gt;


&lt;/div&gt;



	</content>



</entry>
<entry>
	<title>change to tags/kernel on Rog&#xE9;rio Brito&#x27;s Digital Junkyard</title>

	<id>/blog/recentchanges/change_2ffc78aa8b9a152cc4bcf42cc85cebc093adb67e/</id>

	<link href="/blog/recentchanges/#change-2ffc78aa8b9a152cc4bcf42cc85cebc093adb67e"/>

	<author><name>rbrito</name></author>





	<updated>2010-10-08T17:13:25Z</updated>
	<published>2010-10-08T17:13:25Z</published>

	<content type="html" xml:lang="en">
	





&lt;div id=&quot;change-2ffc78aa8b9a152cc4bcf42cc85cebc093adb67e&quot; class=&quot;metadata&quot;&gt;
&lt;span class=&quot;desc&quot;&gt;&lt;br /&gt;Changed pages:&lt;/span&gt;
&lt;span class=&quot;pagelinks&quot;&gt;

tags/kernel

&lt;/span&gt;
&lt;span class=&quot;desc&quot;&gt;&lt;br /&gt;Changed by:&lt;/span&gt;
&lt;span class=&quot;committer&quot;&gt;

rbrito

&lt;/span&gt;
&lt;span class=&quot;desc&quot;&gt;&lt;br /&gt;Commit type:&lt;/span&gt;
&lt;span class=&quot;committype&quot;&gt;git&lt;/span&gt;
&lt;span class=&quot;desc&quot;&gt;&lt;br /&gt;Date:&lt;/span&gt;
&lt;span class=&quot;changedate&quot;&gt;&lt;span class=&quot;date&quot;&gt;02:13:25 PM 10/08/2010&lt;/span&gt;&lt;/span&gt;
&lt;span class=&quot;desc&quot;&gt;&lt;br /&gt;&lt;/span&gt;
&lt;/div&gt;

&lt;div class=&quot;changelog&quot;&gt;


creating tag page tags/kernel&lt;br /&gt;


&lt;/div&gt;



	</content>



</entry>
<entry>
	<title>change to tags/people on Rog&#xE9;rio Brito&#x27;s Digital Junkyard</title>

	<id>/blog/recentchanges/change_80808cabd23747f0059199f5e76bde9127691776/</id>

	<link href="/blog/recentchanges/#change-80808cabd23747f0059199f5e76bde9127691776"/>

	<author><name>rbrito</name></author>





	<updated>2010-10-08T17:13:25Z</updated>
	<published>2010-10-08T17:13:25Z</published>

	<content type="html" xml:lang="en">
	





&lt;div id=&quot;change-80808cabd23747f0059199f5e76bde9127691776&quot; class=&quot;metadata&quot;&gt;
&lt;span class=&quot;desc&quot;&gt;&lt;br /&gt;Changed pages:&lt;/span&gt;
&lt;span class=&quot;pagelinks&quot;&gt;

tags/people

&lt;/span&gt;
&lt;span class=&quot;desc&quot;&gt;&lt;br /&gt;Changed by:&lt;/span&gt;
&lt;span class=&quot;committer&quot;&gt;

rbrito

&lt;/span&gt;
&lt;span class=&quot;desc&quot;&gt;&lt;br /&gt;Commit type:&lt;/span&gt;
&lt;span class=&quot;committype&quot;&gt;git&lt;/span&gt;
&lt;span class=&quot;desc&quot;&gt;&lt;br /&gt;Date:&lt;/span&gt;
&lt;span class=&quot;changedate&quot;&gt;&lt;span class=&quot;date&quot;&gt;02:13:25 PM 10/08/2010&lt;/span&gt;&lt;/span&gt;
&lt;span class=&quot;desc&quot;&gt;&lt;br /&gt;&lt;/span&gt;
&lt;/div&gt;

&lt;div class=&quot;changelog&quot;&gt;


creating tag page tags/people&lt;br /&gt;


&lt;/div&gt;



	</content>



</entry>
<entry>
	<title>change to tags/powerpc on Rog&#xE9;rio Brito&#x27;s Digital Junkyard</title>

	<id>/blog/recentchanges/change_a8561cc85d177ffce248c299311b2d80468a52eb/</id>

	<link href="/blog/recentchanges/#change-a8561cc85d177ffce248c299311b2d80468a52eb"/>

	<author><name>rbrito</name></author>





	<updated>2010-10-08T17:13:25Z</updated>
	<published>2010-10-08T17:13:25Z</published>

	<content type="html" xml:lang="en">
	





&lt;div id=&quot;change-a8561cc85d177ffce248c299311b2d80468a52eb&quot; class=&quot;metadata&quot;&gt;
&lt;span class=&quot;desc&quot;&gt;&lt;br /&gt;Changed pages:&lt;/span&gt;
&lt;span class=&quot;pagelinks&quot;&gt;

tags/powerpc

&lt;/span&gt;
&lt;span class=&quot;desc&quot;&gt;&lt;br /&gt;Changed by:&lt;/span&gt;
&lt;span class=&quot;committer&quot;&gt;

rbrito

&lt;/span&gt;
&lt;span class=&quot;desc&quot;&gt;&lt;br /&gt;Commit type:&lt;/span&gt;
&lt;span class=&quot;committype&quot;&gt;git&lt;/span&gt;
&lt;span class=&quot;desc&quot;&gt;&lt;br /&gt;Date:&lt;/span&gt;
&lt;span class=&quot;changedate&quot;&gt;&lt;span class=&quot;date&quot;&gt;02:13:25 PM 10/08/2010&lt;/span&gt;&lt;/span&gt;
&lt;span class=&quot;desc&quot;&gt;&lt;br /&gt;&lt;/span&gt;
&lt;/div&gt;

&lt;div class=&quot;changelog&quot;&gt;


creating tag page tags/powerpc&lt;br /&gt;


&lt;/div&gt;



	</content>



</entry>
<entry>
	<title>change to tags/typography on Rog&#xE9;rio Brito&#x27;s Digital Junkyard</title>

	<id>/blog/recentchanges/change_f3b7cf6e928b7b62f00b2c33bbe400b983e08c3e/</id>

	<link href="/blog/recentchanges/#change-f3b7cf6e928b7b62f00b2c33bbe400b983e08c3e"/>

	<author><name>rbrito</name></author>





	<updated>2010-10-08T17:13:25Z</updated>
	<published>2010-10-08T17:13:25Z</published>

	<content type="html" xml:lang="en">
	





&lt;div id=&quot;change-f3b7cf6e928b7b62f00b2c33bbe400b983e08c3e&quot; class=&quot;metadata&quot;&gt;
&lt;span class=&quot;desc&quot;&gt;&lt;br /&gt;Changed pages:&lt;/span&gt;
&lt;span class=&quot;pagelinks&quot;&gt;

tags/typography

&lt;/span&gt;
&lt;span class=&quot;desc&quot;&gt;&lt;br /&gt;Changed by:&lt;/span&gt;
&lt;span class=&quot;committer&quot;&gt;

rbrito

&lt;/span&gt;
&lt;span class=&quot;desc&quot;&gt;&lt;br /&gt;Commit type:&lt;/span&gt;
&lt;span class=&quot;committype&quot;&gt;git&lt;/span&gt;
&lt;span class=&quot;desc&quot;&gt;&lt;br /&gt;Date:&lt;/span&gt;
&lt;span class=&quot;changedate&quot;&gt;&lt;span class=&quot;date&quot;&gt;02:13:25 PM 10/08/2010&lt;/span&gt;&lt;/span&gt;
&lt;span class=&quot;desc&quot;&gt;&lt;br /&gt;&lt;/span&gt;
&lt;/div&gt;

&lt;div class=&quot;changelog&quot;&gt;


creating tag page tags/typography&lt;br /&gt;


&lt;/div&gt;



	</content>



</entry>
<entry>
	<title>change to tags/readline on Rog&#xE9;rio Brito&#x27;s Digital Junkyard</title>

	<id>/blog/recentchanges/change_1b5d1c851ffc0752f2ac95ea609322ee5fb5236a/</id>

	<link href="/blog/recentchanges/#change-1b5d1c851ffc0752f2ac95ea609322ee5fb5236a"/>

	<author><name>rbrito</name></author>





	<updated>2010-10-08T17:13:25Z</updated>
	<published>2010-10-08T17:13:25Z</published>

	<content type="html" xml:lang="en">
	





&lt;div id=&quot;change-1b5d1c851ffc0752f2ac95ea609322ee5fb5236a&quot; class=&quot;metadata&quot;&gt;
&lt;span class=&quot;desc&quot;&gt;&lt;br /&gt;Changed pages:&lt;/span&gt;
&lt;span class=&quot;pagelinks&quot;&gt;

tags/readline

&lt;/span&gt;
&lt;span class=&quot;desc&quot;&gt;&lt;br /&gt;Changed by:&lt;/span&gt;
&lt;span class=&quot;committer&quot;&gt;

rbrito

&lt;/span&gt;
&lt;span class=&quot;desc&quot;&gt;&lt;br /&gt;Commit type:&lt;/span&gt;
&lt;span class=&quot;committype&quot;&gt;git&lt;/span&gt;
&lt;span class=&quot;desc&quot;&gt;&lt;br /&gt;Date:&lt;/span&gt;
&lt;span class=&quot;changedate&quot;&gt;&lt;span class=&quot;date&quot;&gt;02:13:25 PM 10/08/2010&lt;/span&gt;&lt;/span&gt;
&lt;span class=&quot;desc&quot;&gt;&lt;br /&gt;&lt;/span&gt;
&lt;/div&gt;

&lt;div class=&quot;changelog&quot;&gt;


creating tag page tags/readline&lt;br /&gt;


&lt;/div&gt;



	</content>



</entry>
<entry>
	<title>change to tags/pdf on Rog&#xE9;rio Brito&#x27;s Digital Junkyard</title>

	<id>/blog/recentchanges/change_f8b8689f14c7e3e89ba12d66024fe94fde81a0aa/</id>

	<link href="/blog/recentchanges/#change-f8b8689f14c7e3e89ba12d66024fe94fde81a0aa"/>

	<author><name>rbrito</name></author>





	<updated>2010-10-08T17:13:25Z</updated>
	<published>2010-10-08T17:13:25Z</published>

	<content type="html" xml:lang="en">
	





&lt;div id=&quot;change-f8b8689f14c7e3e89ba12d66024fe94fde81a0aa&quot; class=&quot;metadata&quot;&gt;
&lt;span class=&quot;desc&quot;&gt;&lt;br /&gt;Changed pages:&lt;/span&gt;
&lt;span class=&quot;pagelinks&quot;&gt;

tags/pdf

&lt;/span&gt;
&lt;span class=&quot;desc&quot;&gt;&lt;br /&gt;Changed by:&lt;/span&gt;
&lt;span class=&quot;committer&quot;&gt;

rbrito

&lt;/span&gt;
&lt;span class=&quot;desc&quot;&gt;&lt;br /&gt;Commit type:&lt;/span&gt;
&lt;span class=&quot;committype&quot;&gt;git&lt;/span&gt;
&lt;span class=&quot;desc&quot;&gt;&lt;br /&gt;Date:&lt;/span&gt;
&lt;span class=&quot;changedate&quot;&gt;&lt;span class=&quot;date&quot;&gt;02:13:25 PM 10/08/2010&lt;/span&gt;&lt;/span&gt;
&lt;span class=&quot;desc&quot;&gt;&lt;br /&gt;&lt;/span&gt;
&lt;/div&gt;

&lt;div class=&quot;changelog&quot;&gt;


creating tag page tags/pdf&lt;br /&gt;


&lt;/div&gt;



	</content>



</entry>
<entry>
	<title>change to tags/git on Rog&#xE9;rio Brito&#x27;s Digital Junkyard</title>

	<id>/blog/recentchanges/change_f89e2ed04a612de3e3806e19f0ac119c9b50ef9d/</id>

	<link href="/blog/recentchanges/#change-f89e2ed04a612de3e3806e19f0ac119c9b50ef9d"/>

	<author><name>rbrito</name></author>





	<updated>2010-10-08T17:13:25Z</updated>
	<published>2010-10-08T17:13:25Z</published>

	<content type="html" xml:lang="en">
	





&lt;div id=&quot;change-f89e2ed04a612de3e3806e19f0ac119c9b50ef9d&quot; class=&quot;metadata&quot;&gt;
&lt;span class=&quot;desc&quot;&gt;&lt;br /&gt;Changed pages:&lt;/span&gt;
&lt;span class=&quot;pagelinks&quot;&gt;

tags/git

&lt;/span&gt;
&lt;span class=&quot;desc&quot;&gt;&lt;br /&gt;Changed by:&lt;/span&gt;
&lt;span class=&quot;committer&quot;&gt;

rbrito

&lt;/span&gt;
&lt;span class=&quot;desc&quot;&gt;&lt;br /&gt;Commit type:&lt;/span&gt;
&lt;span class=&quot;committype&quot;&gt;git&lt;/span&gt;
&lt;span class=&quot;desc&quot;&gt;&lt;br /&gt;Date:&lt;/span&gt;
&lt;span class=&quot;changedate&quot;&gt;&lt;span class=&quot;date&quot;&gt;02:13:25 PM 10/08/2010&lt;/span&gt;&lt;/span&gt;
&lt;span class=&quot;desc&quot;&gt;&lt;br /&gt;&lt;/span&gt;
&lt;/div&gt;

&lt;div class=&quot;changelog&quot;&gt;


creating tag page tags/git&lt;br /&gt;


&lt;/div&gt;



	</content>



</entry>
<entry>
	<title>change to tags/documents on Rog&#xE9;rio Brito&#x27;s Digital Junkyard</title>

	<id>/blog/recentchanges/change_10efae2bf7750372bc110a39c799e9018e1edea0/</id>

	<link href="/blog/recentchanges/#change-10efae2bf7750372bc110a39c799e9018e1edea0"/>

	<author><name>rbrito</name></author>





	<updated>2010-10-08T17:13:25Z</updated>
	<published>2010-10-08T17:13:25Z</published>

	<content type="html" xml:lang="en">
	





&lt;div id=&quot;change-10efae2bf7750372bc110a39c799e9018e1edea0&quot; class=&quot;metadata&quot;&gt;
&lt;span class=&quot;desc&quot;&gt;&lt;br /&gt;Changed pages:&lt;/span&gt;
&lt;span class=&quot;pagelinks&quot;&gt;

tags/documents

&lt;/span&gt;
&lt;span class=&quot;desc&quot;&gt;&lt;br /&gt;Changed by:&lt;/span&gt;
&lt;span class=&quot;committer&quot;&gt;

rbrito

&lt;/span&gt;
&lt;span class=&quot;desc&quot;&gt;&lt;br /&gt;Commit type:&lt;/span&gt;
&lt;span class=&quot;committype&quot;&gt;git&lt;/span&gt;
&lt;span class=&quot;desc&quot;&gt;&lt;br /&gt;Date:&lt;/span&gt;
&lt;span class=&quot;changedate&quot;&gt;&lt;span class=&quot;date&quot;&gt;02:13:25 PM 10/08/2010&lt;/span&gt;&lt;/span&gt;
&lt;span class=&quot;desc&quot;&gt;&lt;br /&gt;&lt;/span&gt;
&lt;/div&gt;

&lt;div class=&quot;changelog&quot;&gt;


creating tag page tags/documents&lt;br /&gt;


&lt;/div&gt;



	</content>



</entry>
<entry>
	<title>change to tags/hacks on Rog&#xE9;rio Brito&#x27;s Digital Junkyard</title>

	<id>/blog/recentchanges/change_a93e174d77d0ded7a84d261c72a885924201d4fd/</id>

	<link href="/blog/recentchanges/#change-a93e174d77d0ded7a84d261c72a885924201d4fd"/>

	<author><name>rbrito</name></author>





	<updated>2010-10-08T17:13:25Z</updated>
	<published>2010-10-08T17:13:25Z</published>

	<content type="html" xml:lang="en">
	





&lt;div id=&quot;change-a93e174d77d0ded7a84d261c72a885924201d4fd&quot; class=&quot;metadata&quot;&gt;
&lt;span class=&quot;desc&quot;&gt;&lt;br /&gt;Changed pages:&lt;/span&gt;
&lt;span class=&quot;pagelinks&quot;&gt;

tags/hacks

&lt;/span&gt;
&lt;span class=&quot;desc&quot;&gt;&lt;br /&gt;Changed by:&lt;/span&gt;
&lt;span class=&quot;committer&quot;&gt;

rbrito

&lt;/span&gt;
&lt;span class=&quot;desc&quot;&gt;&lt;br /&gt;Commit type:&lt;/span&gt;
&lt;span class=&quot;committype&quot;&gt;git&lt;/span&gt;
&lt;span class=&quot;desc&quot;&gt;&lt;br /&gt;Date:&lt;/span&gt;
&lt;span class=&quot;changedate&quot;&gt;&lt;span class=&quot;date&quot;&gt;02:13:25 PM 10/08/2010&lt;/span&gt;&lt;/span&gt;
&lt;span class=&quot;desc&quot;&gt;&lt;br /&gt;&lt;/span&gt;
&lt;/div&gt;

&lt;div class=&quot;changelog&quot;&gt;


creating tag page tags/hacks&lt;br /&gt;


&lt;/div&gt;



	</content>



</entry>
<entry>
	<title>change to tags/revision-control on Rog&#xE9;rio Brito&#x27;s Digital Junkyard</title>

	<id>/blog/recentchanges/change_00b8694fa5dfb47f219aafb8d3cfd39bc16ef54a/</id>

	<link href="/blog/recentchanges/#change-00b8694fa5dfb47f219aafb8d3cfd39bc16ef54a"/>

	<author><name>rbrito</name></author>





	<updated>2010-10-08T17:13:25Z</updated>
	<published>2010-10-08T17:13:25Z</published>

	<content type="html" xml:lang="en">
	





&lt;div id=&quot;change-00b8694fa5dfb47f219aafb8d3cfd39bc16ef54a&quot; class=&quot;metadata&quot;&gt;
&lt;span class=&quot;desc&quot;&gt;&lt;br /&gt;Changed pages:&lt;/span&gt;
&lt;span class=&quot;pagelinks&quot;&gt;

tags/revision-control

&lt;/span&gt;
&lt;span class=&quot;desc&quot;&gt;&lt;br /&gt;Changed by:&lt;/span&gt;
&lt;span class=&quot;committer&quot;&gt;

rbrito

&lt;/span&gt;
&lt;span class=&quot;desc&quot;&gt;&lt;br /&gt;Commit type:&lt;/span&gt;
&lt;span class=&quot;committype&quot;&gt;git&lt;/span&gt;
&lt;span class=&quot;desc&quot;&gt;&lt;br /&gt;Date:&lt;/span&gt;
&lt;span class=&quot;changedate&quot;&gt;&lt;span class=&quot;date&quot;&gt;02:13:25 PM 10/08/2010&lt;/span&gt;&lt;/span&gt;
&lt;span class=&quot;desc&quot;&gt;&lt;br /&gt;&lt;/span&gt;
&lt;/div&gt;

&lt;div class=&quot;changelog&quot;&gt;


creating tag page tags/revision-control&lt;br /&gt;


&lt;/div&gt;



	</content>



</entry>
<entry>
	<title>change to tags/web-of-trust on Rog&#xE9;rio Brito&#x27;s Digital Junkyard</title>

	<id>/blog/recentchanges/change_854b2726b984d06d1cea0b1c3396780945b8cd79/</id>

	<link href="/blog/recentchanges/#change-854b2726b984d06d1cea0b1c3396780945b8cd79"/>

	<author><name>rbrito</name></author>





	<updated>2010-10-08T17:13:25Z</updated>
	<published>2010-10-08T17:13:25Z</published>

	<content type="html" xml:lang="en">
	





&lt;div id=&quot;change-854b2726b984d06d1cea0b1c3396780945b8cd79&quot; class=&quot;metadata&quot;&gt;
&lt;span class=&quot;desc&quot;&gt;&lt;br /&gt;Changed pages:&lt;/span&gt;
&lt;span class=&quot;pagelinks&quot;&gt;

tags/web-of-trust

&lt;/span&gt;
&lt;span class=&quot;desc&quot;&gt;&lt;br /&gt;Changed by:&lt;/span&gt;
&lt;span class=&quot;committer&quot;&gt;

rbrito

&lt;/span&gt;
&lt;span class=&quot;desc&quot;&gt;&lt;br /&gt;Commit type:&lt;/span&gt;
&lt;span class=&quot;committype&quot;&gt;git&lt;/span&gt;
&lt;span class=&quot;desc&quot;&gt;&lt;br /&gt;Date:&lt;/span&gt;
&lt;span class=&quot;changedate&quot;&gt;&lt;span class=&quot;date&quot;&gt;02:13:25 PM 10/08/2010&lt;/span&gt;&lt;/span&gt;
&lt;span class=&quot;desc&quot;&gt;&lt;br /&gt;&lt;/span&gt;
&lt;/div&gt;

&lt;div class=&quot;changelog&quot;&gt;


creating tag page tags/web-of-trust&lt;br /&gt;


&lt;/div&gt;



	</content>



</entry>
<entry>
	<title>change to tags/free-software on Rog&#xE9;rio Brito&#x27;s Digital Junkyard</title>

	<id>/blog/recentchanges/change_5f992329cad549777c9ddc203edfc52fdd0b360c/</id>

	<link href="/blog/recentchanges/#change-5f992329cad549777c9ddc203edfc52fdd0b360c"/>

	<author><name>rbrito</name></author>





	<updated>2010-10-08T17:13:25Z</updated>
	<published>2010-10-08T17:13:25Z</published>

	<content type="html" xml:lang="en">
	





&lt;div id=&quot;change-5f992329cad549777c9ddc203edfc52fdd0b360c&quot; class=&quot;metadata&quot;&gt;
&lt;span class=&quot;desc&quot;&gt;&lt;br /&gt;Changed pages:&lt;/span&gt;
&lt;span class=&quot;pagelinks&quot;&gt;

tags/free-software

&lt;/span&gt;
&lt;span class=&quot;desc&quot;&gt;&lt;br /&gt;Changed by:&lt;/span&gt;
&lt;span class=&quot;committer&quot;&gt;

rbrito

&lt;/span&gt;
&lt;span class=&quot;desc&quot;&gt;&lt;br /&gt;Commit type:&lt;/span&gt;
&lt;span class=&quot;committype&quot;&gt;git&lt;/span&gt;
&lt;span class=&quot;desc&quot;&gt;&lt;br /&gt;Date:&lt;/span&gt;
&lt;span class=&quot;changedate&quot;&gt;&lt;span class=&quot;date&quot;&gt;02:13:25 PM 10/08/2010&lt;/span&gt;&lt;/span&gt;
&lt;span class=&quot;desc&quot;&gt;&lt;br /&gt;&lt;/span&gt;
&lt;/div&gt;

&lt;div class=&quot;changelog&quot;&gt;


creating tag page tags/free-software&lt;br /&gt;


&lt;/div&gt;



	</content>



</entry>
<entry>
	<title>change to tags/development on Rog&#xE9;rio Brito&#x27;s Digital Junkyard</title>

	<id>/blog/recentchanges/change_63b01b7fb178bd304fe1825dd3db996a4d38bc7c/</id>

	<link href="/blog/recentchanges/#change-63b01b7fb178bd304fe1825dd3db996a4d38bc7c"/>

	<author><name>rbrito</name></author>





	<updated>2010-10-08T17:13:24Z</updated>
	<published>2010-10-08T17:13:24Z</published>

	<content type="html" xml:lang="en">
	





&lt;div id=&quot;change-63b01b7fb178bd304fe1825dd3db996a4d38bc7c&quot; class=&quot;metadata&quot;&gt;
&lt;span class=&quot;desc&quot;&gt;&lt;br /&gt;Changed pages:&lt;/span&gt;
&lt;span class=&quot;pagelinks&quot;&gt;

tags/development

&lt;/span&gt;
&lt;span class=&quot;desc&quot;&gt;&lt;br /&gt;Changed by:&lt;/span&gt;
&lt;span class=&quot;committer&quot;&gt;

rbrito

&lt;/span&gt;
&lt;span class=&quot;desc&quot;&gt;&lt;br /&gt;Commit type:&lt;/span&gt;
&lt;span class=&quot;committype&quot;&gt;git&lt;/span&gt;
&lt;span class=&quot;desc&quot;&gt;&lt;br /&gt;Date:&lt;/span&gt;
&lt;span class=&quot;changedate&quot;&gt;&lt;span class=&quot;date&quot;&gt;02:13:24 PM 10/08/2010&lt;/span&gt;&lt;/span&gt;
&lt;span class=&quot;desc&quot;&gt;&lt;br /&gt;&lt;/span&gt;
&lt;/div&gt;

&lt;div class=&quot;changelog&quot;&gt;


creating tag page tags/development&lt;br /&gt;


&lt;/div&gt;



	</content>



</entry>
<entry>
	<title>change to tags/fonts on Rog&#xE9;rio Brito&#x27;s Digital Junkyard</title>

	<id>/blog/recentchanges/change_35881d015b1655316f7ec4683503993eb368f341/</id>

	<link href="/blog/recentchanges/#change-35881d015b1655316f7ec4683503993eb368f341"/>

	<author><name>rbrito</name></author>





	<updated>2010-10-08T17:13:24Z</updated>
	<published>2010-10-08T17:13:24Z</published>

	<content type="html" xml:lang="en">
	





&lt;div id=&quot;change-35881d015b1655316f7ec4683503993eb368f341&quot; class=&quot;metadata&quot;&gt;
&lt;span class=&quot;desc&quot;&gt;&lt;br /&gt;Changed pages:&lt;/span&gt;
&lt;span class=&quot;pagelinks&quot;&gt;

tags/fonts

&lt;/span&gt;
&lt;span class=&quot;desc&quot;&gt;&lt;br /&gt;Changed by:&lt;/span&gt;
&lt;span class=&quot;committer&quot;&gt;

rbrito

&lt;/span&gt;
&lt;span class=&quot;desc&quot;&gt;&lt;br /&gt;Commit type:&lt;/span&gt;
&lt;span class=&quot;committype&quot;&gt;git&lt;/span&gt;
&lt;span class=&quot;desc&quot;&gt;&lt;br /&gt;Date:&lt;/span&gt;
&lt;span class=&quot;changedate&quot;&gt;&lt;span class=&quot;date&quot;&gt;02:13:24 PM 10/08/2010&lt;/span&gt;&lt;/span&gt;
&lt;span class=&quot;desc&quot;&gt;&lt;br /&gt;&lt;/span&gt;
&lt;/div&gt;

&lt;div class=&quot;changelog&quot;&gt;


creating tag page tags/fonts&lt;br /&gt;


&lt;/div&gt;



	</content>



</entry>
<entry>
	<title>change to tags/programming on Rog&#xE9;rio Brito&#x27;s Digital Junkyard</title>

	<id>/blog/recentchanges/change_1987019ed1d0d59a62adad35b9bb2a0d03c4ea48/</id>

	<link href="/blog/recentchanges/#change-1987019ed1d0d59a62adad35b9bb2a0d03c4ea48"/>

	<author><name>rbrito</name></author>





	<updated>2010-10-08T17:13:24Z</updated>
	<published>2010-10-08T17:13:24Z</published>

	<content type="html" xml:lang="en">
	





&lt;div id=&quot;change-1987019ed1d0d59a62adad35b9bb2a0d03c4ea48&quot; class=&quot;metadata&quot;&gt;
&lt;span class=&quot;desc&quot;&gt;&lt;br /&gt;Changed pages:&lt;/span&gt;
&lt;span class=&quot;pagelinks&quot;&gt;

tags/programming

&lt;/span&gt;
&lt;span class=&quot;desc&quot;&gt;&lt;br /&gt;Changed by:&lt;/span&gt;
&lt;span class=&quot;committer&quot;&gt;

rbrito

&lt;/span&gt;
&lt;span class=&quot;desc&quot;&gt;&lt;br /&gt;Commit type:&lt;/span&gt;
&lt;span class=&quot;committype&quot;&gt;git&lt;/span&gt;
&lt;span class=&quot;desc&quot;&gt;&lt;br /&gt;Date:&lt;/span&gt;
&lt;span class=&quot;changedate&quot;&gt;&lt;span class=&quot;date&quot;&gt;02:13:24 PM 10/08/2010&lt;/span&gt;&lt;/span&gt;
&lt;span class=&quot;desc&quot;&gt;&lt;br /&gt;&lt;/span&gt;
&lt;/div&gt;

&lt;div class=&quot;changelog&quot;&gt;


creating tag page tags/programming&lt;br /&gt;


&lt;/div&gt;



	</content>



</entry>
<entry>
	<title>change to tags/audio on Rog&#xE9;rio Brito&#x27;s Digital Junkyard</title>

	<id>/blog/recentchanges/change_b4ae93a74e8e41111976c6515b237076206ad221/</id>

	<link href="/blog/recentchanges/#change-b4ae93a74e8e41111976c6515b237076206ad221"/>

	<author><name>rbrito</name></author>





	<updated>2010-10-08T17:13:24Z</updated>
	<published>2010-10-08T17:13:24Z</published>

	<content type="html" xml:lang="en">
	





&lt;div id=&quot;change-b4ae93a74e8e41111976c6515b237076206ad221&quot; class=&quot;metadata&quot;&gt;
&lt;span class=&quot;desc&quot;&gt;&lt;br /&gt;Changed pages:&lt;/span&gt;
&lt;span class=&quot;pagelinks&quot;&gt;

tags/audio

&lt;/span&gt;
&lt;span class=&quot;desc&quot;&gt;&lt;br /&gt;Changed by:&lt;/span&gt;
&lt;span class=&quot;committer&quot;&gt;

rbrito

&lt;/span&gt;
&lt;span class=&quot;desc&quot;&gt;&lt;br /&gt;Commit type:&lt;/span&gt;
&lt;span class=&quot;committype&quot;&gt;git&lt;/span&gt;
&lt;span class=&quot;desc&quot;&gt;&lt;br /&gt;Date:&lt;/span&gt;
&lt;span class=&quot;changedate&quot;&gt;&lt;span class=&quot;date&quot;&gt;02:13:24 PM 10/08/2010&lt;/span&gt;&lt;/span&gt;
&lt;span class=&quot;desc&quot;&gt;&lt;br /&gt;&lt;/span&gt;
&lt;/div&gt;

&lt;div class=&quot;changelog&quot;&gt;


creating tag page tags/audio&lt;br /&gt;


&lt;/div&gt;



	</content>



</entry>
<entry>
	<title>change to tags/c++ on Rog&#xE9;rio Brito&#x27;s Digital Junkyard</title>

	<id>/blog/recentchanges/change_61919dda425fb355ec2d36600163f100e74859c1/</id>

	<link href="/blog/recentchanges/#change-61919dda425fb355ec2d36600163f100e74859c1"/>

	<author><name>rbrito</name></author>





	<updated>2010-10-08T17:13:24Z</updated>
	<published>2010-10-08T17:13:24Z</published>

	<content type="html" xml:lang="en">
	





&lt;div id=&quot;change-61919dda425fb355ec2d36600163f100e74859c1&quot; class=&quot;metadata&quot;&gt;
&lt;span class=&quot;desc&quot;&gt;&lt;br /&gt;Changed pages:&lt;/span&gt;
&lt;span class=&quot;pagelinks&quot;&gt;

tags/c++

&lt;/span&gt;
&lt;span class=&quot;desc&quot;&gt;&lt;br /&gt;Changed by:&lt;/span&gt;
&lt;span class=&quot;committer&quot;&gt;

rbrito

&lt;/span&gt;
&lt;span class=&quot;desc&quot;&gt;&lt;br /&gt;Commit type:&lt;/span&gt;
&lt;span class=&quot;committype&quot;&gt;git&lt;/span&gt;
&lt;span class=&quot;desc&quot;&gt;&lt;br /&gt;Date:&lt;/span&gt;
&lt;span class=&quot;changedate&quot;&gt;&lt;span class=&quot;date&quot;&gt;02:13:24 PM 10/08/2010&lt;/span&gt;&lt;/span&gt;
&lt;span class=&quot;desc&quot;&gt;&lt;br /&gt;&lt;/span&gt;
&lt;/div&gt;

&lt;div class=&quot;changelog&quot;&gt;


creating tag page tags/c++&lt;br /&gt;


&lt;/div&gt;



	</content>



</entry>
<entry>
	<title>change to tags/kurobox on Rog&#xE9;rio Brito&#x27;s Digital Junkyard</title>

	<id>/blog/recentchanges/change_1a959250f0e2143d67564c830acd1449fb91d5bc/</id>

	<link href="/blog/recentchanges/#change-1a959250f0e2143d67564c830acd1449fb91d5bc"/>

	<author><name>rbrito</name></author>





	<updated>2010-10-08T17:13:24Z</updated>
	<published>2010-10-08T17:13:24Z</published>

	<content type="html" xml:lang="en">
	





&lt;div id=&quot;change-1a959250f0e2143d67564c830acd1449fb91d5bc&quot; class=&quot;metadata&quot;&gt;
&lt;span class=&quot;desc&quot;&gt;&lt;br /&gt;Changed pages:&lt;/span&gt;
&lt;span class=&quot;pagelinks&quot;&gt;

tags/kurobox

&lt;/span&gt;
&lt;span class=&quot;desc&quot;&gt;&lt;br /&gt;Changed by:&lt;/span&gt;
&lt;span class=&quot;committer&quot;&gt;

rbrito

&lt;/span&gt;
&lt;span class=&quot;desc&quot;&gt;&lt;br /&gt;Commit type:&lt;/span&gt;
&lt;span class=&quot;committype&quot;&gt;git&lt;/span&gt;
&lt;span class=&quot;desc&quot;&gt;&lt;br /&gt;Date:&lt;/span&gt;
&lt;span class=&quot;changedate&quot;&gt;&lt;span class=&quot;date&quot;&gt;02:13:24 PM 10/08/2010&lt;/span&gt;&lt;/span&gt;
&lt;span class=&quot;desc&quot;&gt;&lt;br /&gt;&lt;/span&gt;
&lt;/div&gt;

&lt;div class=&quot;changelog&quot;&gt;


creating tag page tags/kurobox&lt;br /&gt;


&lt;/div&gt;



	</content>



</entry>
<entry>
	<title>change to tags/xetex on Rog&#xE9;rio Brito&#x27;s Digital Junkyard</title>

	<id>/blog/recentchanges/change_83bb29f8a0eabb1b30683df5ac21f9fb8c84f993/</id>

	<link href="/blog/recentchanges/#change-83bb29f8a0eabb1b30683df5ac21f9fb8c84f993"/>

	<author><name>rbrito</name></author>





	<updated>2010-10-08T17:13:24Z</updated>
	<published>2010-10-08T17:13:24Z</published>

	<content type="html" xml:lang="en">
	





&lt;div id=&quot;change-83bb29f8a0eabb1b30683df5ac21f9fb8c84f993&quot; class=&quot;metadata&quot;&gt;
&lt;span class=&quot;desc&quot;&gt;&lt;br /&gt;Changed pages:&lt;/span&gt;
&lt;span class=&quot;pagelinks&quot;&gt;

tags/xetex

&lt;/span&gt;
&lt;span class=&quot;desc&quot;&gt;&lt;br /&gt;Changed by:&lt;/span&gt;
&lt;span class=&quot;committer&quot;&gt;

rbrito

&lt;/span&gt;
&lt;span class=&quot;desc&quot;&gt;&lt;br /&gt;Commit type:&lt;/span&gt;
&lt;span class=&quot;committype&quot;&gt;git&lt;/span&gt;
&lt;span class=&quot;desc&quot;&gt;&lt;br /&gt;Date:&lt;/span&gt;
&lt;span class=&quot;changedate&quot;&gt;&lt;span class=&quot;date&quot;&gt;02:13:24 PM 10/08/2010&lt;/span&gt;&lt;/span&gt;
&lt;span class=&quot;desc&quot;&gt;&lt;br /&gt;&lt;/span&gt;
&lt;/div&gt;

&lt;div class=&quot;changelog&quot;&gt;


creating tag page tags/xetex&lt;br /&gt;


&lt;/div&gt;



	</content>



</entry>
<entry>
	<title>change to tags/bugs on Rog&#xE9;rio Brito&#x27;s Digital Junkyard</title>

	<id>/blog/recentchanges/change_89bf2c7b152f6fa51f0916491bbd835f93f6de5e/</id>

	<link href="/blog/recentchanges/#change-89bf2c7b152f6fa51f0916491bbd835f93f6de5e"/>

	<author><name>rbrito</name></author>





	<updated>2010-10-08T17:13:24Z</updated>
	<published>2010-10-08T17:13:24Z</published>

	<content type="html" xml:lang="en">
	





&lt;div id=&quot;change-89bf2c7b152f6fa51f0916491bbd835f93f6de5e&quot; class=&quot;metadata&quot;&gt;
&lt;span class=&quot;desc&quot;&gt;&lt;br /&gt;Changed pages:&lt;/span&gt;
&lt;span class=&quot;pagelinks&quot;&gt;

tags/bugs

&lt;/span&gt;
&lt;span class=&quot;desc&quot;&gt;&lt;br /&gt;Changed by:&lt;/span&gt;
&lt;span class=&quot;committer&quot;&gt;

rbrito

&lt;/span&gt;
&lt;span class=&quot;desc&quot;&gt;&lt;br /&gt;Commit type:&lt;/span&gt;
&lt;span class=&quot;committype&quot;&gt;git&lt;/span&gt;
&lt;span class=&quot;desc&quot;&gt;&lt;br /&gt;Date:&lt;/span&gt;
&lt;span class=&quot;changedate&quot;&gt;&lt;span class=&quot;date&quot;&gt;02:13:24 PM 10/08/2010&lt;/span&gt;&lt;/span&gt;
&lt;span class=&quot;desc&quot;&gt;&lt;br /&gt;&lt;/span&gt;
&lt;/div&gt;

&lt;div class=&quot;changelog&quot;&gt;


creating tag page tags/bugs&lt;br /&gt;


&lt;/div&gt;



	</content>



</entry>
<entry>
	<title>change to tags/tex on Rog&#xE9;rio Brito&#x27;s Digital Junkyard</title>

	<id>/blog/recentchanges/change_7f2772240c2f5c2432ef543b4b9173974e7fd0e3/</id>

	<link href="/blog/recentchanges/#change-7f2772240c2f5c2432ef543b4b9173974e7fd0e3"/>

	<author><name>rbrito</name></author>





	<updated>2010-10-08T17:13:24Z</updated>
	<published>2010-10-08T17:13:24Z</published>

	<content type="html" xml:lang="en">
	





&lt;div id=&quot;change-7f2772240c2f5c2432ef543b4b9173974e7fd0e3&quot; class=&quot;metadata&quot;&gt;
&lt;span class=&quot;desc&quot;&gt;&lt;br /&gt;Changed pages:&lt;/span&gt;
&lt;span class=&quot;pagelinks&quot;&gt;

tags/tex

&lt;/span&gt;
&lt;span class=&quot;desc&quot;&gt;&lt;br /&gt;Changed by:&lt;/span&gt;
&lt;span class=&quot;committer&quot;&gt;

rbrito

&lt;/span&gt;
&lt;span class=&quot;desc&quot;&gt;&lt;br /&gt;Commit type:&lt;/span&gt;
&lt;span class=&quot;committype&quot;&gt;git&lt;/span&gt;
&lt;span class=&quot;desc&quot;&gt;&lt;br /&gt;Date:&lt;/span&gt;
&lt;span class=&quot;changedate&quot;&gt;&lt;span class=&quot;date&quot;&gt;02:13:24 PM 10/08/2010&lt;/span&gt;&lt;/span&gt;
&lt;span class=&quot;desc&quot;&gt;&lt;br /&gt;&lt;/span&gt;
&lt;/div&gt;

&lt;div class=&quot;changelog&quot;&gt;


creating tag page tags/tex&lt;br /&gt;


&lt;/div&gt;



	</content>



</entry>
<entry>
	<title>change to tags/productivity on Rog&#xE9;rio Brito&#x27;s Digital Junkyard</title>

	<id>/blog/recentchanges/change_9e8e898486e904ffa027d3356ae5c7c5927b3d75/</id>

	<link href="/blog/recentchanges/#change-9e8e898486e904ffa027d3356ae5c7c5927b3d75"/>

	<author><name>rbrito</name></author>





	<updated>2010-10-08T17:13:24Z</updated>
	<published>2010-10-08T17:13:24Z</published>

	<content type="html" xml:lang="en">
	





&lt;div id=&quot;change-9e8e898486e904ffa027d3356ae5c7c5927b3d75&quot; class=&quot;metadata&quot;&gt;
&lt;span class=&quot;desc&quot;&gt;&lt;br /&gt;Changed pages:&lt;/span&gt;
&lt;span class=&quot;pagelinks&quot;&gt;

tags/productivity

&lt;/span&gt;
&lt;span class=&quot;desc&quot;&gt;&lt;br /&gt;Changed by:&lt;/span&gt;
&lt;span class=&quot;committer&quot;&gt;

rbrito

&lt;/span&gt;
&lt;span class=&quot;desc&quot;&gt;&lt;br /&gt;Commit type:&lt;/span&gt;
&lt;span class=&quot;committype&quot;&gt;git&lt;/span&gt;
&lt;span class=&quot;desc&quot;&gt;&lt;br /&gt;Date:&lt;/span&gt;
&lt;span class=&quot;changedate&quot;&gt;&lt;span class=&quot;date&quot;&gt;02:13:24 PM 10/08/2010&lt;/span&gt;&lt;/span&gt;
&lt;span class=&quot;desc&quot;&gt;&lt;br /&gt;&lt;/span&gt;
&lt;/div&gt;

&lt;div class=&quot;changelog&quot;&gt;


creating tag page tags/productivity&lt;br /&gt;


&lt;/div&gt;



	</content>



</entry>
<entry>
	<title>change to tags/configuration on Rog&#xE9;rio Brito&#x27;s Digital Junkyard</title>

	<id>/blog/recentchanges/change_f36009912672c7436373d18f47f82587849beaa0/</id>

	<link href="/blog/recentchanges/#change-f36009912672c7436373d18f47f82587849beaa0"/>

	<author><name>rbrito</name></author>





	<updated>2010-10-08T17:13:24Z</updated>
	<published>2010-10-08T17:13:24Z</published>

	<content type="html" xml:lang="en">
	





&lt;div id=&quot;change-f36009912672c7436373d18f47f82587849beaa0&quot; class=&quot;metadata&quot;&gt;
&lt;span class=&quot;desc&quot;&gt;&lt;br /&gt;Changed pages:&lt;/span&gt;
&lt;span class=&quot;pagelinks&quot;&gt;

tags/configuration

&lt;/span&gt;
&lt;span class=&quot;desc&quot;&gt;&lt;br /&gt;Changed by:&lt;/span&gt;
&lt;span class=&quot;committer&quot;&gt;

rbrito

&lt;/span&gt;
&lt;span class=&quot;desc&quot;&gt;&lt;br /&gt;Commit type:&lt;/span&gt;
&lt;span class=&quot;committype&quot;&gt;git&lt;/span&gt;
&lt;span class=&quot;desc&quot;&gt;&lt;br /&gt;Date:&lt;/span&gt;
&lt;span class=&quot;changedate&quot;&gt;&lt;span class=&quot;date&quot;&gt;02:13:24 PM 10/08/2010&lt;/span&gt;&lt;/span&gt;
&lt;span class=&quot;desc&quot;&gt;&lt;br /&gt;&lt;/span&gt;
&lt;/div&gt;

&lt;div class=&quot;changelog&quot;&gt;


creating tag page tags/configuration&lt;br /&gt;


&lt;/div&gt;



	</content>



</entry>
<entry>
	<title>change to tags/debian on Rog&#xE9;rio Brito&#x27;s Digital Junkyard</title>

	<id>/blog/recentchanges/change_dfde9d10d4d212ea17f9a9234f8a4ae18a3c169b/</id>

	<link href="/blog/recentchanges/#change-dfde9d10d4d212ea17f9a9234f8a4ae18a3c169b"/>

	<author><name>rbrito</name></author>





	<updated>2010-10-08T17:13:24Z</updated>
	<published>2010-10-08T17:13:24Z</published>

	<content type="html" xml:lang="en">
	





&lt;div id=&quot;change-dfde9d10d4d212ea17f9a9234f8a4ae18a3c169b&quot; class=&quot;metadata&quot;&gt;
&lt;span class=&quot;desc&quot;&gt;&lt;br /&gt;Changed pages:&lt;/span&gt;
&lt;span class=&quot;pagelinks&quot;&gt;

tags/debian

&lt;/span&gt;
&lt;span class=&quot;desc&quot;&gt;&lt;br /&gt;Changed by:&lt;/span&gt;
&lt;span class=&quot;committer&quot;&gt;

rbrito

&lt;/span&gt;
&lt;span class=&quot;desc&quot;&gt;&lt;br /&gt;Commit type:&lt;/span&gt;
&lt;span class=&quot;committype&quot;&gt;git&lt;/span&gt;
&lt;span class=&quot;desc&quot;&gt;&lt;br /&gt;Date:&lt;/span&gt;
&lt;span class=&quot;changedate&quot;&gt;&lt;span class=&quot;date&quot;&gt;02:13:24 PM 10/08/2010&lt;/span&gt;&lt;/span&gt;
&lt;span class=&quot;desc&quot;&gt;&lt;br /&gt;&lt;/span&gt;
&lt;/div&gt;

&lt;div class=&quot;changelog&quot;&gt;


creating tag page tags/debian&lt;br /&gt;


&lt;/div&gt;



	</content>



</entry>
<entry>
	<title>change to tags/linux on Rog&#xE9;rio Brito&#x27;s Digital Junkyard</title>

	<id>/blog/recentchanges/change_563ec4639daf7a8f6e9d0f2525689c5823bc6df8/</id>

	<link href="/blog/recentchanges/#change-563ec4639daf7a8f6e9d0f2525689c5823bc6df8"/>

	<author><name>rbrito</name></author>





	<updated>2010-10-08T17:13:24Z</updated>
	<published>2010-10-08T17:13:24Z</published>

	<content type="html" xml:lang="en">
	





&lt;div id=&quot;change-563ec4639daf7a8f6e9d0f2525689c5823bc6df8&quot; class=&quot;metadata&quot;&gt;
&lt;span class=&quot;desc&quot;&gt;&lt;br /&gt;Changed pages:&lt;/span&gt;
&lt;span class=&quot;pagelinks&quot;&gt;

tags/linux

&lt;/span&gt;
&lt;span class=&quot;desc&quot;&gt;&lt;br /&gt;Changed by:&lt;/span&gt;
&lt;span class=&quot;committer&quot;&gt;

rbrito

&lt;/span&gt;
&lt;span class=&quot;desc&quot;&gt;&lt;br /&gt;Commit type:&lt;/span&gt;
&lt;span class=&quot;committype&quot;&gt;git&lt;/span&gt;
&lt;span class=&quot;desc&quot;&gt;&lt;br /&gt;Date:&lt;/span&gt;
&lt;span class=&quot;changedate&quot;&gt;&lt;span class=&quot;date&quot;&gt;02:13:24 PM 10/08/2010&lt;/span&gt;&lt;/span&gt;
&lt;span class=&quot;desc&quot;&gt;&lt;br /&gt;&lt;/span&gt;
&lt;/div&gt;

&lt;div class=&quot;changelog&quot;&gt;


creating tag page tags/linux&lt;br /&gt;


&lt;/div&gt;



	</content>



</entry>
<entry>
	<title>change to tags/uncategorized on Rog&#xE9;rio Brito&#x27;s Digital Junkyard</title>

	<id>/blog/recentchanges/change_6eb23268fa7032d9ba90faf4a5970faa9bf594c8/</id>

	<link href="/blog/recentchanges/#change-6eb23268fa7032d9ba90faf4a5970faa9bf594c8"/>

	<author><name>rbrito</name></author>





	<updated>2010-10-08T17:13:24Z</updated>
	<published>2010-10-08T17:13:24Z</published>

	<content type="html" xml:lang="en">
	





&lt;div id=&quot;change-6eb23268fa7032d9ba90faf4a5970faa9bf594c8&quot; class=&quot;metadata&quot;&gt;
&lt;span class=&quot;desc&quot;&gt;&lt;br /&gt;Changed pages:&lt;/span&gt;
&lt;span class=&quot;pagelinks&quot;&gt;

tags/uncategorized

&lt;/span&gt;
&lt;span class=&quot;desc&quot;&gt;&lt;br /&gt;Changed by:&lt;/span&gt;
&lt;span class=&quot;committer&quot;&gt;

rbrito

&lt;/span&gt;
&lt;span class=&quot;desc&quot;&gt;&lt;br /&gt;Commit type:&lt;/span&gt;
&lt;span class=&quot;committype&quot;&gt;git&lt;/span&gt;
&lt;span class=&quot;desc&quot;&gt;&lt;br /&gt;Date:&lt;/span&gt;
&lt;span class=&quot;changedate&quot;&gt;&lt;span class=&quot;date&quot;&gt;02:13:24 PM 10/08/2010&lt;/span&gt;&lt;/span&gt;
&lt;span class=&quot;desc&quot;&gt;&lt;br /&gt;&lt;/span&gt;
&lt;/div&gt;

&lt;div class=&quot;changelog&quot;&gt;


creating tag page tags/uncategorized&lt;br /&gt;


&lt;/div&gt;



	</content>



</entry>
<entry>
	<title>change to .gitignore archives comments index posts posts/first_post sidebar tags on Rog&#xE9;rio Brito&#x27;s Digital Junkyard</title>

	<id>/blog/recentchanges/change_c24de22b34b16f18b5fa234e47b07705d36a7475/</id>

	<link href="/blog/recentchanges/#change-c24de22b34b16f18b5fa234e47b07705d36a7475"/>

	<author><name>rbrito</name></author>





	<updated>2010-10-08T17:13:12Z</updated>
	<published>2010-10-08T17:13:12Z</published>

	<content type="html" xml:lang="en">
	





&lt;div id=&quot;change-c24de22b34b16f18b5fa234e47b07705d36a7475&quot; class=&quot;metadata&quot;&gt;
&lt;span class=&quot;desc&quot;&gt;&lt;br /&gt;Changed pages:&lt;/span&gt;
&lt;span class=&quot;pagelinks&quot;&gt;

.gitignore

archives

comments

index

posts

posts/first post

sidebar

tags

&lt;/span&gt;
&lt;span class=&quot;desc&quot;&gt;&lt;br /&gt;Changed by:&lt;/span&gt;
&lt;span class=&quot;committer&quot;&gt;

rbrito

&lt;/span&gt;
&lt;span class=&quot;desc&quot;&gt;&lt;br /&gt;Commit type:&lt;/span&gt;
&lt;span class=&quot;committype&quot;&gt;git&lt;/span&gt;
&lt;span class=&quot;desc&quot;&gt;&lt;br /&gt;Date:&lt;/span&gt;
&lt;span class=&quot;changedate&quot;&gt;&lt;span class=&quot;date&quot;&gt;02:13:12 PM 10/08/2010&lt;/span&gt;&lt;/span&gt;
&lt;span class=&quot;desc&quot;&gt;&lt;br /&gt;&lt;/span&gt;
&lt;/div&gt;

&lt;div class=&quot;changelog&quot;&gt;


initial commit&lt;br /&gt;


&lt;/div&gt;



	</content>



</entry>
<entry>
	<title>change to posts/2009-11-18 on Rog&#xE9;rio Brito&#x27;s Digital Junkyard</title>

	<id>/blog/recentchanges/change_a0c15b9086fcc9eac831c4d3f660a93cae240e62/</id>

	<link href="/blog/recentchanges/#change-a0c15b9086fcc9eac831c4d3f660a93cae240e62"/>

	<author><name>rbrito</name></author>





	<updated>2009-11-18T02:00:00Z</updated>
	<published>2009-11-18T02:00:00Z</published>

	<content type="html" xml:lang="en">
	





&lt;div id=&quot;change-a0c15b9086fcc9eac831c4d3f660a93cae240e62&quot; class=&quot;metadata&quot;&gt;
&lt;span class=&quot;desc&quot;&gt;&lt;br /&gt;Changed pages:&lt;/span&gt;
&lt;span class=&quot;pagelinks&quot;&gt;

posts/2009-11-18

&lt;/span&gt;
&lt;span class=&quot;desc&quot;&gt;&lt;br /&gt;Changed by:&lt;/span&gt;
&lt;span class=&quot;committer&quot;&gt;

rbrito

&lt;/span&gt;
&lt;span class=&quot;desc&quot;&gt;&lt;br /&gt;Commit type:&lt;/span&gt;
&lt;span class=&quot;committype&quot;&gt;git&lt;/span&gt;
&lt;span class=&quot;desc&quot;&gt;&lt;br /&gt;Date:&lt;/span&gt;
&lt;span class=&quot;changedate&quot;&gt;&lt;span class=&quot;date&quot;&gt;12:00:00 AM 11/18/2009&lt;/span&gt;&lt;/span&gt;
&lt;span class=&quot;desc&quot;&gt;&lt;br /&gt;&lt;/span&gt;
&lt;/div&gt;

&lt;div class=&quot;changelog&quot;&gt;


Import of 2009-11-18.mdwn&lt;br /&gt;


&lt;/div&gt;



	</content>



</entry>
<entry>
	<title>change to posts/2009-10-08 on Rog&#xE9;rio Brito&#x27;s Digital Junkyard</title>

	<id>/blog/recentchanges/change_88a0492b89fdf4b06b7f4842557270690aeb6548/</id>

	<link href="/blog/recentchanges/#change-88a0492b89fdf4b06b7f4842557270690aeb6548"/>

	<author><name>rbrito</name></author>





	<updated>2009-10-08T03:00:00Z</updated>
	<published>2009-10-08T03:00:00Z</published>

	<content type="html" xml:lang="en">
	





&lt;div id=&quot;change-88a0492b89fdf4b06b7f4842557270690aeb6548&quot; class=&quot;metadata&quot;&gt;
&lt;span class=&quot;desc&quot;&gt;&lt;br /&gt;Changed pages:&lt;/span&gt;
&lt;span class=&quot;pagelinks&quot;&gt;

posts/2009-10-08

&lt;/span&gt;
&lt;span class=&quot;desc&quot;&gt;&lt;br /&gt;Changed by:&lt;/span&gt;
&lt;span class=&quot;committer&quot;&gt;

rbrito

&lt;/span&gt;
&lt;span class=&quot;desc&quot;&gt;&lt;br /&gt;Commit type:&lt;/span&gt;
&lt;span class=&quot;committype&quot;&gt;git&lt;/span&gt;
&lt;span class=&quot;desc&quot;&gt;&lt;br /&gt;Date:&lt;/span&gt;
&lt;span class=&quot;changedate&quot;&gt;&lt;span class=&quot;date&quot;&gt;12:00:00 AM 10/08/2009&lt;/span&gt;&lt;/span&gt;
&lt;span class=&quot;desc&quot;&gt;&lt;br /&gt;&lt;/span&gt;
&lt;/div&gt;

&lt;div class=&quot;changelog&quot;&gt;


Import of 2009-10-08.mdwn&lt;br /&gt;


&lt;/div&gt;



	</content>



</entry>
<entry>
	<title>change to posts/2009-09-11 on Rog&#xE9;rio Brito&#x27;s Digital Junkyard</title>

	<id>/blog/recentchanges/change_b923da17c458f111d2b9f9bca651962c51c22331/</id>

	<link href="/blog/recentchanges/#change-b923da17c458f111d2b9f9bca651962c51c22331"/>

	<author><name>rbrito</name></author>





	<updated>2009-09-11T03:00:00Z</updated>
	<published>2009-09-11T03:00:00Z</published>

	<content type="html" xml:lang="en">
	





&lt;div id=&quot;change-b923da17c458f111d2b9f9bca651962c51c22331&quot; class=&quot;metadata&quot;&gt;
&lt;span class=&quot;desc&quot;&gt;&lt;br /&gt;Changed pages:&lt;/span&gt;
&lt;span class=&quot;pagelinks&quot;&gt;

posts/2009-09-11

&lt;/span&gt;
&lt;span class=&quot;desc&quot;&gt;&lt;br /&gt;Changed by:&lt;/span&gt;
&lt;span class=&quot;committer&quot;&gt;

rbrito

&lt;/span&gt;
&lt;span class=&quot;desc&quot;&gt;&lt;br /&gt;Commit type:&lt;/span&gt;
&lt;span class=&quot;committype&quot;&gt;git&lt;/span&gt;
&lt;span class=&quot;desc&quot;&gt;&lt;br /&gt;Date:&lt;/span&gt;
&lt;span class=&quot;changedate&quot;&gt;&lt;span class=&quot;date&quot;&gt;12:00:00 AM 09/11/2009&lt;/span&gt;&lt;/span&gt;
&lt;span class=&quot;desc&quot;&gt;&lt;br /&gt;&lt;/span&gt;
&lt;/div&gt;

&lt;div class=&quot;changelog&quot;&gt;


Import of 2009-09-11.mdwn&lt;br /&gt;


&lt;/div&gt;



	</content>



</entry>
<entry>
	<title>change to posts/2009-09-05 on Rog&#xE9;rio Brito&#x27;s Digital Junkyard</title>

	<id>/blog/recentchanges/change_c419bfe50fe265b7a2cad679a4fcb7304cd30a92/</id>

	<link href="/blog/recentchanges/#change-c419bfe50fe265b7a2cad679a4fcb7304cd30a92"/>

	<author><name>rbrito</name></author>





	<updated>2009-09-05T03:00:00Z</updated>
	<published>2009-09-05T03:00:00Z</published>

	<content type="html" xml:lang="en">
	





&lt;div id=&quot;change-c419bfe50fe265b7a2cad679a4fcb7304cd30a92&quot; class=&quot;metadata&quot;&gt;
&lt;span class=&quot;desc&quot;&gt;&lt;br /&gt;Changed pages:&lt;/span&gt;
&lt;span class=&quot;pagelinks&quot;&gt;

posts/2009-09-05

&lt;/span&gt;
&lt;span class=&quot;desc&quot;&gt;&lt;br /&gt;Changed by:&lt;/span&gt;
&lt;span class=&quot;committer&quot;&gt;

rbrito

&lt;/span&gt;
&lt;span class=&quot;desc&quot;&gt;&lt;br /&gt;Commit type:&lt;/span&gt;
&lt;span class=&quot;committype&quot;&gt;git&lt;/span&gt;
&lt;span class=&quot;desc&quot;&gt;&lt;br /&gt;Date:&lt;/span&gt;
&lt;span class=&quot;changedate&quot;&gt;&lt;span class=&quot;date&quot;&gt;12:00:00 AM 09/05/2009&lt;/span&gt;&lt;/span&gt;
&lt;span class=&quot;desc&quot;&gt;&lt;br /&gt;&lt;/span&gt;
&lt;/div&gt;

&lt;div class=&quot;changelog&quot;&gt;


Import of 2009-09-05.mdwn&lt;br /&gt;


&lt;/div&gt;



	</content>



</entry>
<entry>
	<title>change to posts/2009-09-04 on Rog&#xE9;rio Brito&#x27;s Digital Junkyard</title>

	<id>/blog/recentchanges/change_6a93f01af3df1d792ce8c0194aec2fe49f423db6/</id>

	<link href="/blog/recentchanges/#change-6a93f01af3df1d792ce8c0194aec2fe49f423db6"/>

	<author><name>rbrito</name></author>





	<updated>2009-09-04T03:00:00Z</updated>
	<published>2009-09-04T03:00:00Z</published>

	<content type="html" xml:lang="en">
	





&lt;div id=&quot;change-6a93f01af3df1d792ce8c0194aec2fe49f423db6&quot; class=&quot;metadata&quot;&gt;
&lt;span class=&quot;desc&quot;&gt;&lt;br /&gt;Changed pages:&lt;/span&gt;
&lt;span class=&quot;pagelinks&quot;&gt;

posts/2009-09-04

&lt;/span&gt;
&lt;span class=&quot;desc&quot;&gt;&lt;br /&gt;Changed by:&lt;/span&gt;
&lt;span class=&quot;committer&quot;&gt;

rbrito

&lt;/span&gt;
&lt;span class=&quot;desc&quot;&gt;&lt;br /&gt;Commit type:&lt;/span&gt;
&lt;span class=&quot;committype&quot;&gt;git&lt;/span&gt;
&lt;span class=&quot;desc&quot;&gt;&lt;br /&gt;Date:&lt;/span&gt;
&lt;span class=&quot;changedate&quot;&gt;&lt;span class=&quot;date&quot;&gt;12:00:00 AM 09/04/2009&lt;/span&gt;&lt;/span&gt;
&lt;span class=&quot;desc&quot;&gt;&lt;br /&gt;&lt;/span&gt;
&lt;/div&gt;

&lt;div class=&quot;changelog&quot;&gt;


Import of 2009-09-04.mdwn&lt;br /&gt;


&lt;/div&gt;



	</content>



</entry>
<entry>
	<title>change to posts/2009-08-28 on Rog&#xE9;rio Brito&#x27;s Digital Junkyard</title>

	<id>/blog/recentchanges/change_fedadb44f591ecd0d28256d67f1b4a3ee5352af3/</id>

	<link href="/blog/recentchanges/#change-fedadb44f591ecd0d28256d67f1b4a3ee5352af3"/>

	<author><name>rbrito</name></author>





	<updated>2009-08-28T03:00:00Z</updated>
	<published>2009-08-28T03:00:00Z</published>

	<content type="html" xml:lang="en">
	





&lt;div id=&quot;change-fedadb44f591ecd0d28256d67f1b4a3ee5352af3&quot; class=&quot;metadata&quot;&gt;
&lt;span class=&quot;desc&quot;&gt;&lt;br /&gt;Changed pages:&lt;/span&gt;
&lt;span class=&quot;pagelinks&quot;&gt;

posts/2009-08-28

&lt;/span&gt;
&lt;span class=&quot;desc&quot;&gt;&lt;br /&gt;Changed by:&lt;/span&gt;
&lt;span class=&quot;committer&quot;&gt;

rbrito

&lt;/span&gt;
&lt;span class=&quot;desc&quot;&gt;&lt;br /&gt;Commit type:&lt;/span&gt;
&lt;span class=&quot;committype&quot;&gt;git&lt;/span&gt;
&lt;span class=&quot;desc&quot;&gt;&lt;br /&gt;Date:&lt;/span&gt;
&lt;span class=&quot;changedate&quot;&gt;&lt;span class=&quot;date&quot;&gt;12:00:00 AM 08/28/2009&lt;/span&gt;&lt;/span&gt;
&lt;span class=&quot;desc&quot;&gt;&lt;br /&gt;&lt;/span&gt;
&lt;/div&gt;

&lt;div class=&quot;changelog&quot;&gt;


Import of 2009-08-28.mdwn&lt;br /&gt;


&lt;/div&gt;



	</content>



</entry>
<entry>
	<title>change to posts/2009-08-05 on Rog&#xE9;rio Brito&#x27;s Digital Junkyard</title>

	<id>/blog/recentchanges/change_83890b0b95861c5fefb51fc55dca1d6e81ccadaa/</id>

	<link href="/blog/recentchanges/#change-83890b0b95861c5fefb51fc55dca1d6e81ccadaa"/>

	<author><name>rbrito</name></author>





	<updated>2009-08-05T03:00:00Z</updated>
	<published>2009-08-05T03:00:00Z</published>

	<content type="html" xml:lang="en">
	





&lt;div id=&quot;change-83890b0b95861c5fefb51fc55dca1d6e81ccadaa&quot; class=&quot;metadata&quot;&gt;
&lt;span class=&quot;desc&quot;&gt;&lt;br /&gt;Changed pages:&lt;/span&gt;
&lt;span class=&quot;pagelinks&quot;&gt;

posts/2009-08-05

&lt;/span&gt;
&lt;span class=&quot;desc&quot;&gt;&lt;br /&gt;Changed by:&lt;/span&gt;
&lt;span class=&quot;committer&quot;&gt;

rbrito

&lt;/span&gt;
&lt;span class=&quot;desc&quot;&gt;&lt;br /&gt;Commit type:&lt;/span&gt;
&lt;span class=&quot;committype&quot;&gt;git&lt;/span&gt;
&lt;span class=&quot;desc&quot;&gt;&lt;br /&gt;Date:&lt;/span&gt;
&lt;span class=&quot;changedate&quot;&gt;&lt;span class=&quot;date&quot;&gt;12:00:00 AM 08/05/2009&lt;/span&gt;&lt;/span&gt;
&lt;span class=&quot;desc&quot;&gt;&lt;br /&gt;&lt;/span&gt;
&lt;/div&gt;

&lt;div class=&quot;changelog&quot;&gt;


Import of 2009-08-05.mdwn&lt;br /&gt;


&lt;/div&gt;



	</content>



</entry>
<entry>
	<title>change to posts/2009-08-04 on Rog&#xE9;rio Brito&#x27;s Digital Junkyard</title>

	<id>/blog/recentchanges/change_ff5088df79fc14c7273fd331dd81368457231df6/</id>

	<link href="/blog/recentchanges/#change-ff5088df79fc14c7273fd331dd81368457231df6"/>

	<author><name>rbrito</name></author>





	<updated>2009-08-04T03:00:00Z</updated>
	<published>2009-08-04T03:00:00Z</published>

	<content type="html" xml:lang="en">
	





&lt;div id=&quot;change-ff5088df79fc14c7273fd331dd81368457231df6&quot; class=&quot;metadata&quot;&gt;
&lt;span class=&quot;desc&quot;&gt;&lt;br /&gt;Changed pages:&lt;/span&gt;
&lt;span class=&quot;pagelinks&quot;&gt;

posts/2009-08-04

&lt;/span&gt;
&lt;span class=&quot;desc&quot;&gt;&lt;br /&gt;Changed by:&lt;/span&gt;
&lt;span class=&quot;committer&quot;&gt;

rbrito

&lt;/span&gt;
&lt;span class=&quot;desc&quot;&gt;&lt;br /&gt;Commit type:&lt;/span&gt;
&lt;span class=&quot;committype&quot;&gt;git&lt;/span&gt;
&lt;span class=&quot;desc&quot;&gt;&lt;br /&gt;Date:&lt;/span&gt;
&lt;span class=&quot;changedate&quot;&gt;&lt;span class=&quot;date&quot;&gt;12:00:00 AM 08/04/2009&lt;/span&gt;&lt;/span&gt;
&lt;span class=&quot;desc&quot;&gt;&lt;br /&gt;&lt;/span&gt;
&lt;/div&gt;

&lt;div class=&quot;changelog&quot;&gt;


Import of 2009-08-04.mdwn&lt;br /&gt;


&lt;/div&gt;



	</content>



</entry>
<entry>
	<title>change to posts/2009-08-03 on Rog&#xE9;rio Brito&#x27;s Digital Junkyard</title>

	<id>/blog/recentchanges/change_86b6066592c5d103a489fb30d7b3b70fed545e32/</id>

	<link href="/blog/recentchanges/#change-86b6066592c5d103a489fb30d7b3b70fed545e32"/>

	<author><name>rbrito</name></author>





	<updated>2009-08-03T03:00:00Z</updated>
	<published>2009-08-03T03:00:00Z</published>

	<content type="html" xml:lang="en">
	





&lt;div id=&quot;change-86b6066592c5d103a489fb30d7b3b70fed545e32&quot; class=&quot;metadata&quot;&gt;
&lt;span class=&quot;desc&quot;&gt;&lt;br /&gt;Changed pages:&lt;/span&gt;
&lt;span class=&quot;pagelinks&quot;&gt;

posts/2009-08-03

&lt;/span&gt;
&lt;span class=&quot;desc&quot;&gt;&lt;br /&gt;Changed by:&lt;/span&gt;
&lt;span class=&quot;committer&quot;&gt;

rbrito

&lt;/span&gt;
&lt;span class=&quot;desc&quot;&gt;&lt;br /&gt;Commit type:&lt;/span&gt;
&lt;span class=&quot;committype&quot;&gt;git&lt;/span&gt;
&lt;span class=&quot;desc&quot;&gt;&lt;br /&gt;Date:&lt;/span&gt;
&lt;span class=&quot;changedate&quot;&gt;&lt;span class=&quot;date&quot;&gt;12:00:00 AM 08/03/2009&lt;/span&gt;&lt;/span&gt;
&lt;span class=&quot;desc&quot;&gt;&lt;br /&gt;&lt;/span&gt;
&lt;/div&gt;

&lt;div class=&quot;changelog&quot;&gt;


Import of 2009-08-03.mdwn&lt;br /&gt;


&lt;/div&gt;



	</content>



</entry>
<entry>
	<title>change to posts/2009-06-02 on Rog&#xE9;rio Brito&#x27;s Digital Junkyard</title>

	<id>/blog/recentchanges/change_dc95de78c6753d0a6317faeb06e0c5542eff4f4a/</id>

	<link href="/blog/recentchanges/#change-dc95de78c6753d0a6317faeb06e0c5542eff4f4a"/>

	<author><name>rbrito</name></author>





	<updated>2009-06-02T03:00:00Z</updated>
	<published>2009-06-02T03:00:00Z</published>

	<content type="html" xml:lang="en">
	





&lt;div id=&quot;change-dc95de78c6753d0a6317faeb06e0c5542eff4f4a&quot; class=&quot;metadata&quot;&gt;
&lt;span class=&quot;desc&quot;&gt;&lt;br /&gt;Changed pages:&lt;/span&gt;
&lt;span class=&quot;pagelinks&quot;&gt;

posts/2009-06-02

&lt;/span&gt;
&lt;span class=&quot;desc&quot;&gt;&lt;br /&gt;Changed by:&lt;/span&gt;
&lt;span class=&quot;committer&quot;&gt;

rbrito

&lt;/span&gt;
&lt;span class=&quot;desc&quot;&gt;&lt;br /&gt;Commit type:&lt;/span&gt;
&lt;span class=&quot;committype&quot;&gt;git&lt;/span&gt;
&lt;span class=&quot;desc&quot;&gt;&lt;br /&gt;Date:&lt;/span&gt;
&lt;span class=&quot;changedate&quot;&gt;&lt;span class=&quot;date&quot;&gt;12:00:00 AM 06/02/2009&lt;/span&gt;&lt;/span&gt;
&lt;span class=&quot;desc&quot;&gt;&lt;br /&gt;&lt;/span&gt;
&lt;/div&gt;

&lt;div class=&quot;changelog&quot;&gt;


Import of 2009-06-02.mdwn&lt;br /&gt;


&lt;/div&gt;



	</content>



</entry>
<entry>
	<title>change to posts/2009-05-08 on Rog&#xE9;rio Brito&#x27;s Digital Junkyard</title>

	<id>/blog/recentchanges/change_f867c74cc51fdfa6612a1730bb7932abed9934e9/</id>

	<link href="/blog/recentchanges/#change-f867c74cc51fdfa6612a1730bb7932abed9934e9"/>

	<author><name>rbrito</name></author>





	<updated>2009-05-08T03:00:00Z</updated>
	<published>2009-05-08T03:00:00Z</published>

	<content type="html" xml:lang="en">
	





&lt;div id=&quot;change-f867c74cc51fdfa6612a1730bb7932abed9934e9&quot; class=&quot;metadata&quot;&gt;
&lt;span class=&quot;desc&quot;&gt;&lt;br /&gt;Changed pages:&lt;/span&gt;
&lt;span class=&quot;pagelinks&quot;&gt;

posts/2009-05-08

&lt;/span&gt;
&lt;span class=&quot;desc&quot;&gt;&lt;br /&gt;Changed by:&lt;/span&gt;
&lt;span class=&quot;committer&quot;&gt;

rbrito

&lt;/span&gt;
&lt;span class=&quot;desc&quot;&gt;&lt;br /&gt;Commit type:&lt;/span&gt;
&lt;span class=&quot;committype&quot;&gt;git&lt;/span&gt;
&lt;span class=&quot;desc&quot;&gt;&lt;br /&gt;Date:&lt;/span&gt;
&lt;span class=&quot;changedate&quot;&gt;&lt;span class=&quot;date&quot;&gt;12:00:00 AM 05/08/2009&lt;/span&gt;&lt;/span&gt;
&lt;span class=&quot;desc&quot;&gt;&lt;br /&gt;&lt;/span&gt;
&lt;/div&gt;

&lt;div class=&quot;changelog&quot;&gt;


Import of 2009-05-08.mdwn&lt;br /&gt;


&lt;/div&gt;



	</content>



</entry>
<entry>
	<title>change to posts/2009-05-07 on Rog&#xE9;rio Brito&#x27;s Digital Junkyard</title>

	<id>/blog/recentchanges/change_db8ee6dc772f7a26d0c7dc0fe3562cd6b43fdb86/</id>

	<link href="/blog/recentchanges/#change-db8ee6dc772f7a26d0c7dc0fe3562cd6b43fdb86"/>

	<author><name>rbrito</name></author>





	<updated>2009-05-07T03:00:00Z</updated>
	<published>2009-05-07T03:00:00Z</published>

	<content type="html" xml:lang="en">
	





&lt;div id=&quot;change-db8ee6dc772f7a26d0c7dc0fe3562cd6b43fdb86&quot; class=&quot;metadata&quot;&gt;
&lt;span class=&quot;desc&quot;&gt;&lt;br /&gt;Changed pages:&lt;/span&gt;
&lt;span class=&quot;pagelinks&quot;&gt;

posts/2009-05-07

&lt;/span&gt;
&lt;span class=&quot;desc&quot;&gt;&lt;br /&gt;Changed by:&lt;/span&gt;
&lt;span class=&quot;committer&quot;&gt;

rbrito

&lt;/span&gt;
&lt;span class=&quot;desc&quot;&gt;&lt;br /&gt;Commit type:&lt;/span&gt;
&lt;span class=&quot;committype&quot;&gt;git&lt;/span&gt;
&lt;span class=&quot;desc&quot;&gt;&lt;br /&gt;Date:&lt;/span&gt;
&lt;span class=&quot;changedate&quot;&gt;&lt;span class=&quot;date&quot;&gt;12:00:00 AM 05/07/2009&lt;/span&gt;&lt;/span&gt;
&lt;span class=&quot;desc&quot;&gt;&lt;br /&gt;&lt;/span&gt;
&lt;/div&gt;

&lt;div class=&quot;changelog&quot;&gt;


Import of 2009-05-07.mdwn&lt;br /&gt;


&lt;/div&gt;



	</content>



</entry>
<entry>
	<title>change to posts/2009-04-05 on Rog&#xE9;rio Brito&#x27;s Digital Junkyard</title>

	<id>/blog/recentchanges/change_ace6219f3141b5f1ddb3111f339e8277a093cd83/</id>

	<link href="/blog/recentchanges/#change-ace6219f3141b5f1ddb3111f339e8277a093cd83"/>

	<author><name>rbrito</name></author>





	<updated>2009-04-05T03:00:00Z</updated>
	<published>2009-04-05T03:00:00Z</published>

	<content type="html" xml:lang="en">
	





&lt;div id=&quot;change-ace6219f3141b5f1ddb3111f339e8277a093cd83&quot; class=&quot;metadata&quot;&gt;
&lt;span class=&quot;desc&quot;&gt;&lt;br /&gt;Changed pages:&lt;/span&gt;
&lt;span class=&quot;pagelinks&quot;&gt;

posts/2009-04-05

&lt;/span&gt;
&lt;span class=&quot;desc&quot;&gt;&lt;br /&gt;Changed by:&lt;/span&gt;
&lt;span class=&quot;committer&quot;&gt;

rbrito

&lt;/span&gt;
&lt;span class=&quot;desc&quot;&gt;&lt;br /&gt;Commit type:&lt;/span&gt;
&lt;span class=&quot;committype&quot;&gt;git&lt;/span&gt;
&lt;span class=&quot;desc&quot;&gt;&lt;br /&gt;Date:&lt;/span&gt;
&lt;span class=&quot;changedate&quot;&gt;&lt;span class=&quot;date&quot;&gt;12:00:00 AM 04/05/2009&lt;/span&gt;&lt;/span&gt;
&lt;span class=&quot;desc&quot;&gt;&lt;br /&gt;&lt;/span&gt;
&lt;/div&gt;

&lt;div class=&quot;changelog&quot;&gt;


Import of 2009-04-05.mdwn&lt;br /&gt;


&lt;/div&gt;



	</content>



</entry>
<entry>
	<title>change to posts/2009-03-27 on Rog&#xE9;rio Brito&#x27;s Digital Junkyard</title>

	<id>/blog/recentchanges/change_b7524f91ba27bea8821112b719867fe9c44bce89/</id>

	<link href="/blog/recentchanges/#change-b7524f91ba27bea8821112b719867fe9c44bce89"/>

	<author><name>rbrito</name></author>





	<updated>2009-03-27T03:00:00Z</updated>
	<published>2009-03-27T03:00:00Z</published>

	<content type="html" xml:lang="en">
	





&lt;div id=&quot;change-b7524f91ba27bea8821112b719867fe9c44bce89&quot; class=&quot;metadata&quot;&gt;
&lt;span class=&quot;desc&quot;&gt;&lt;br /&gt;Changed pages:&lt;/span&gt;
&lt;span class=&quot;pagelinks&quot;&gt;

posts/2009-03-27

&lt;/span&gt;
&lt;span class=&quot;desc&quot;&gt;&lt;br /&gt;Changed by:&lt;/span&gt;
&lt;span class=&quot;committer&quot;&gt;

rbrito

&lt;/span&gt;
&lt;span class=&quot;desc&quot;&gt;&lt;br /&gt;Commit type:&lt;/span&gt;
&lt;span class=&quot;committype&quot;&gt;git&lt;/span&gt;
&lt;span class=&quot;desc&quot;&gt;&lt;br /&gt;Date:&lt;/span&gt;
&lt;span class=&quot;changedate&quot;&gt;&lt;span class=&quot;date&quot;&gt;12:00:00 AM 03/27/2009&lt;/span&gt;&lt;/span&gt;
&lt;span class=&quot;desc&quot;&gt;&lt;br /&gt;&lt;/span&gt;
&lt;/div&gt;

&lt;div class=&quot;changelog&quot;&gt;


Import of 2009-03-27.mdwn&lt;br /&gt;


&lt;/div&gt;



	</content>



</entry>
<entry>
	<title>change to posts/2009-03-15 on Rog&#xE9;rio Brito&#x27;s Digital Junkyard</title>

	<id>/blog/recentchanges/change_2790e35566414759ae0c1b82ed3386d80627f534/</id>

	<link href="/blog/recentchanges/#change-2790e35566414759ae0c1b82ed3386d80627f534"/>

	<author><name>rbrito</name></author>





	<updated>2009-03-15T03:00:00Z</updated>
	<published>2009-03-15T03:00:00Z</published>

	<content type="html" xml:lang="en">
	





&lt;div id=&quot;change-2790e35566414759ae0c1b82ed3386d80627f534&quot; class=&quot;metadata&quot;&gt;
&lt;span class=&quot;desc&quot;&gt;&lt;br /&gt;Changed pages:&lt;/span&gt;
&lt;span class=&quot;pagelinks&quot;&gt;

posts/2009-03-15

&lt;/span&gt;
&lt;span class=&quot;desc&quot;&gt;&lt;br /&gt;Changed by:&lt;/span&gt;
&lt;span class=&quot;committer&quot;&gt;

rbrito

&lt;/span&gt;
&lt;span class=&quot;desc&quot;&gt;&lt;br /&gt;Commit type:&lt;/span&gt;
&lt;span class=&quot;committype&quot;&gt;git&lt;/span&gt;
&lt;span class=&quot;desc&quot;&gt;&lt;br /&gt;Date:&lt;/span&gt;
&lt;span class=&quot;changedate&quot;&gt;&lt;span class=&quot;date&quot;&gt;12:00:00 AM 03/15/2009&lt;/span&gt;&lt;/span&gt;
&lt;span class=&quot;desc&quot;&gt;&lt;br /&gt;&lt;/span&gt;
&lt;/div&gt;

&lt;div class=&quot;changelog&quot;&gt;


Import of 2009-03-15.mdwn&lt;br /&gt;


&lt;/div&gt;



	</content>



</entry>
<entry>
	<title>change to posts/2009-03-14 on Rog&#xE9;rio Brito&#x27;s Digital Junkyard</title>

	<id>/blog/recentchanges/change_3902752f356fdd7a8c997e7544e3703d47df7048/</id>

	<link href="/blog/recentchanges/#change-3902752f356fdd7a8c997e7544e3703d47df7048"/>

	<author><name>rbrito</name></author>





	<updated>2009-03-14T03:00:00Z</updated>
	<published>2009-03-14T03:00:00Z</published>

	<content type="html" xml:lang="en">
	





&lt;div id=&quot;change-3902752f356fdd7a8c997e7544e3703d47df7048&quot; class=&quot;metadata&quot;&gt;
&lt;span class=&quot;desc&quot;&gt;&lt;br /&gt;Changed pages:&lt;/span&gt;
&lt;span class=&quot;pagelinks&quot;&gt;

posts/2009-03-14

&lt;/span&gt;
&lt;span class=&quot;desc&quot;&gt;&lt;br /&gt;Changed by:&lt;/span&gt;
&lt;span class=&quot;committer&quot;&gt;

rbrito

&lt;/span&gt;
&lt;span class=&quot;desc&quot;&gt;&lt;br /&gt;Commit type:&lt;/span&gt;
&lt;span class=&quot;committype&quot;&gt;git&lt;/span&gt;
&lt;span class=&quot;desc&quot;&gt;&lt;br /&gt;Date:&lt;/span&gt;
&lt;span class=&quot;changedate&quot;&gt;&lt;span class=&quot;date&quot;&gt;12:00:00 AM 03/14/2009&lt;/span&gt;&lt;/span&gt;
&lt;span class=&quot;desc&quot;&gt;&lt;br /&gt;&lt;/span&gt;
&lt;/div&gt;

&lt;div class=&quot;changelog&quot;&gt;


Import of 2009-03-14.mdwn&lt;br /&gt;


&lt;/div&gt;



	</content>



</entry>
<entry>
	<title>change to posts/2009-03-10 on Rog&#xE9;rio Brito&#x27;s Digital Junkyard</title>

	<id>/blog/recentchanges/change_3e1d1273f438ec4580619faa0fcf750b537edfbc/</id>

	<link href="/blog/recentchanges/#change-3e1d1273f438ec4580619faa0fcf750b537edfbc"/>

	<author><name>rbrito</name></author>





	<updated>2009-03-10T03:00:00Z</updated>
	<published>2009-03-10T03:00:00Z</published>

	<content type="html" xml:lang="en">
	





&lt;div id=&quot;change-3e1d1273f438ec4580619faa0fcf750b537edfbc&quot; class=&quot;metadata&quot;&gt;
&lt;span class=&quot;desc&quot;&gt;&lt;br /&gt;Changed pages:&lt;/span&gt;
&lt;span class=&quot;pagelinks&quot;&gt;

posts/2009-03-10

&lt;/span&gt;
&lt;span class=&quot;desc&quot;&gt;&lt;br /&gt;Changed by:&lt;/span&gt;
&lt;span class=&quot;committer&quot;&gt;

rbrito

&lt;/span&gt;
&lt;span class=&quot;desc&quot;&gt;&lt;br /&gt;Commit type:&lt;/span&gt;
&lt;span class=&quot;committype&quot;&gt;git&lt;/span&gt;
&lt;span class=&quot;desc&quot;&gt;&lt;br /&gt;Date:&lt;/span&gt;
&lt;span class=&quot;changedate&quot;&gt;&lt;span class=&quot;date&quot;&gt;12:00:00 AM 03/10/2009&lt;/span&gt;&lt;/span&gt;
&lt;span class=&quot;desc&quot;&gt;&lt;br /&gt;&lt;/span&gt;
&lt;/div&gt;

&lt;div class=&quot;changelog&quot;&gt;


Import of 2009-03-10.mdwn&lt;br /&gt;


&lt;/div&gt;



	</content>



</entry>
<entry>
	<title>change to posts/2009-03-07 on Rog&#xE9;rio Brito&#x27;s Digital Junkyard</title>

	<id>/blog/recentchanges/change_c319d76c0bb21b6df052e4036dcdb46d679ddcc7/</id>

	<link href="/blog/recentchanges/#change-c319d76c0bb21b6df052e4036dcdb46d679ddcc7"/>

	<author><name>rbrito</name></author>





	<updated>2009-03-07T03:00:00Z</updated>
	<published>2009-03-07T03:00:00Z</published>

	<content type="html" xml:lang="en">
	





&lt;div id=&quot;change-c319d76c0bb21b6df052e4036dcdb46d679ddcc7&quot; class=&quot;metadata&quot;&gt;
&lt;span class=&quot;desc&quot;&gt;&lt;br /&gt;Changed pages:&lt;/span&gt;
&lt;span class=&quot;pagelinks&quot;&gt;

posts/2009-03-07

&lt;/span&gt;
&lt;span class=&quot;desc&quot;&gt;&lt;br /&gt;Changed by:&lt;/span&gt;
&lt;span class=&quot;committer&quot;&gt;

rbrito

&lt;/span&gt;
&lt;span class=&quot;desc&quot;&gt;&lt;br /&gt;Commit type:&lt;/span&gt;
&lt;span class=&quot;committype&quot;&gt;git&lt;/span&gt;
&lt;span class=&quot;desc&quot;&gt;&lt;br /&gt;Date:&lt;/span&gt;
&lt;span class=&quot;changedate&quot;&gt;&lt;span class=&quot;date&quot;&gt;12:00:00 AM 03/07/2009&lt;/span&gt;&lt;/span&gt;
&lt;span class=&quot;desc&quot;&gt;&lt;br /&gt;&lt;/span&gt;
&lt;/div&gt;

&lt;div class=&quot;changelog&quot;&gt;


Import of 2009-03-07.mdwn&lt;br /&gt;


&lt;/div&gt;



	</content>



</entry>
<entry>
	<title>change to posts/2009-03-06 on Rog&#xE9;rio Brito&#x27;s Digital Junkyard</title>

	<id>/blog/recentchanges/change_55940e76484cf1500d522ad1d9711577bf95ede0/</id>

	<link href="/blog/recentchanges/#change-55940e76484cf1500d522ad1d9711577bf95ede0"/>

	<author><name>rbrito</name></author>





	<updated>2009-03-06T03:00:00Z</updated>
	<published>2009-03-06T03:00:00Z</published>

	<content type="html" xml:lang="en">
	





&lt;div id=&quot;change-55940e76484cf1500d522ad1d9711577bf95ede0&quot; class=&quot;metadata&quot;&gt;
&lt;span class=&quot;desc&quot;&gt;&lt;br /&gt;Changed pages:&lt;/span&gt;
&lt;span class=&quot;pagelinks&quot;&gt;

posts/2009-03-06

&lt;/span&gt;
&lt;span class=&quot;desc&quot;&gt;&lt;br /&gt;Changed by:&lt;/span&gt;
&lt;span class=&quot;committer&quot;&gt;

rbrito

&lt;/span&gt;
&lt;span class=&quot;desc&quot;&gt;&lt;br /&gt;Commit type:&lt;/span&gt;
&lt;span class=&quot;committype&quot;&gt;git&lt;/span&gt;
&lt;span class=&quot;desc&quot;&gt;&lt;br /&gt;Date:&lt;/span&gt;
&lt;span class=&quot;changedate&quot;&gt;&lt;span class=&quot;date&quot;&gt;12:00:00 AM 03/06/2009&lt;/span&gt;&lt;/span&gt;
&lt;span class=&quot;desc&quot;&gt;&lt;br /&gt;&lt;/span&gt;
&lt;/div&gt;

&lt;div class=&quot;changelog&quot;&gt;


Import of 2009-03-06.mdwn&lt;br /&gt;


&lt;/div&gt;



	</content>



</entry>
<entry>
	<title>change to posts/2009-03-05 on Rog&#xE9;rio Brito&#x27;s Digital Junkyard</title>

	<id>/blog/recentchanges/change_33033b9deb2836073b5c8221f20c48eb39cab56a/</id>

	<link href="/blog/recentchanges/#change-33033b9deb2836073b5c8221f20c48eb39cab56a"/>

	<author><name>rbrito</name></author>





	<updated>2009-03-05T03:00:00Z</updated>
	<published>2009-03-05T03:00:00Z</published>

	<content type="html" xml:lang="en">
	





&lt;div id=&quot;change-33033b9deb2836073b5c8221f20c48eb39cab56a&quot; class=&quot;metadata&quot;&gt;
&lt;span class=&quot;desc&quot;&gt;&lt;br /&gt;Changed pages:&lt;/span&gt;
&lt;span class=&quot;pagelinks&quot;&gt;

posts/2009-03-05

&lt;/span&gt;
&lt;span class=&quot;desc&quot;&gt;&lt;br /&gt;Changed by:&lt;/span&gt;
&lt;span class=&quot;committer&quot;&gt;

rbrito

&lt;/span&gt;
&lt;span class=&quot;desc&quot;&gt;&lt;br /&gt;Commit type:&lt;/span&gt;
&lt;span class=&quot;committype&quot;&gt;git&lt;/span&gt;
&lt;span class=&quot;desc&quot;&gt;&lt;br /&gt;Date:&lt;/span&gt;
&lt;span class=&quot;changedate&quot;&gt;&lt;span class=&quot;date&quot;&gt;12:00:00 AM 03/05/2009&lt;/span&gt;&lt;/span&gt;
&lt;span class=&quot;desc&quot;&gt;&lt;br /&gt;&lt;/span&gt;
&lt;/div&gt;

&lt;div class=&quot;changelog&quot;&gt;


Import of 2009-03-05.mdwn&lt;br /&gt;


&lt;/div&gt;



	</content>



</entry>
<entry>
	<title>change to posts/2009-03-03 on Rog&#xE9;rio Brito&#x27;s Digital Junkyard</title>

	<id>/blog/recentchanges/change_cebedb862f8659fba08008b9669605dc7fbcbce9/</id>

	<link href="/blog/recentchanges/#change-cebedb862f8659fba08008b9669605dc7fbcbce9"/>

	<author><name>rbrito</name></author>





	<updated>2009-03-03T03:00:00Z</updated>
	<published>2009-03-03T03:00:00Z</published>

	<content type="html" xml:lang="en">
	





&lt;div id=&quot;change-cebedb862f8659fba08008b9669605dc7fbcbce9&quot; class=&quot;metadata&quot;&gt;
&lt;span class=&quot;desc&quot;&gt;&lt;br /&gt;Changed pages:&lt;/span&gt;
&lt;span class=&quot;pagelinks&quot;&gt;

posts/2009-03-03

&lt;/span&gt;
&lt;span class=&quot;desc&quot;&gt;&lt;br /&gt;Changed by:&lt;/span&gt;
&lt;span class=&quot;committer&quot;&gt;

rbrito

&lt;/span&gt;
&lt;span class=&quot;desc&quot;&gt;&lt;br /&gt;Commit type:&lt;/span&gt;
&lt;span class=&quot;committype&quot;&gt;git&lt;/span&gt;
&lt;span class=&quot;desc&quot;&gt;&lt;br /&gt;Date:&lt;/span&gt;
&lt;span class=&quot;changedate&quot;&gt;&lt;span class=&quot;date&quot;&gt;12:00:00 AM 03/03/2009&lt;/span&gt;&lt;/span&gt;
&lt;span class=&quot;desc&quot;&gt;&lt;br /&gt;&lt;/span&gt;
&lt;/div&gt;

&lt;div class=&quot;changelog&quot;&gt;


Import of 2009-03-03.mdwn&lt;br /&gt;


&lt;/div&gt;



	</content>



</entry>
<entry>
	<title>change to posts/2009-02-04 on Rog&#xE9;rio Brito&#x27;s Digital Junkyard</title>

	<id>/blog/recentchanges/change_3b838867a107fc1cccad2c1de5137ac74c8d1871/</id>

	<link href="/blog/recentchanges/#change-3b838867a107fc1cccad2c1de5137ac74c8d1871"/>

	<author><name>rbrito</name></author>





	<updated>2009-02-04T02:00:00Z</updated>
	<published>2009-02-04T02:00:00Z</published>

	<content type="html" xml:lang="en">
	





&lt;div id=&quot;change-3b838867a107fc1cccad2c1de5137ac74c8d1871&quot; class=&quot;metadata&quot;&gt;
&lt;span class=&quot;desc&quot;&gt;&lt;br /&gt;Changed pages:&lt;/span&gt;
&lt;span class=&quot;pagelinks&quot;&gt;

posts/2009-02-04

&lt;/span&gt;
&lt;span class=&quot;desc&quot;&gt;&lt;br /&gt;Changed by:&lt;/span&gt;
&lt;span class=&quot;committer&quot;&gt;

rbrito

&lt;/span&gt;
&lt;span class=&quot;desc&quot;&gt;&lt;br /&gt;Commit type:&lt;/span&gt;
&lt;span class=&quot;committype&quot;&gt;git&lt;/span&gt;
&lt;span class=&quot;desc&quot;&gt;&lt;br /&gt;Date:&lt;/span&gt;
&lt;span class=&quot;changedate&quot;&gt;&lt;span class=&quot;date&quot;&gt;12:00:00 AM 02/04/2009&lt;/span&gt;&lt;/span&gt;
&lt;span class=&quot;desc&quot;&gt;&lt;br /&gt;&lt;/span&gt;
&lt;/div&gt;

&lt;div class=&quot;changelog&quot;&gt;


Import of 2009-02-04.mdwn&lt;br /&gt;


&lt;/div&gt;



	</content>



</entry>
<entry>
	<title>change to posts/2009-02-03 on Rog&#xE9;rio Brito&#x27;s Digital Junkyard</title>

	<id>/blog/recentchanges/change_e11132e891f56202574d80cf7ef9011b8fad332d/</id>

	<link href="/blog/recentchanges/#change-e11132e891f56202574d80cf7ef9011b8fad332d"/>

	<author><name>rbrito</name></author>





	<updated>2009-02-03T02:00:00Z</updated>
	<published>2009-02-03T02:00:00Z</published>

	<content type="html" xml:lang="en">
	





&lt;div id=&quot;change-e11132e891f56202574d80cf7ef9011b8fad332d&quot; class=&quot;metadata&quot;&gt;
&lt;span class=&quot;desc&quot;&gt;&lt;br /&gt;Changed pages:&lt;/span&gt;
&lt;span class=&quot;pagelinks&quot;&gt;

posts/2009-02-03

&lt;/span&gt;
&lt;span class=&quot;desc&quot;&gt;&lt;br /&gt;Changed by:&lt;/span&gt;
&lt;span class=&quot;committer&quot;&gt;

rbrito

&lt;/span&gt;
&lt;span class=&quot;desc&quot;&gt;&lt;br /&gt;Commit type:&lt;/span&gt;
&lt;span class=&quot;committype&quot;&gt;git&lt;/span&gt;
&lt;span class=&quot;desc&quot;&gt;&lt;br /&gt;Date:&lt;/span&gt;
&lt;span class=&quot;changedate&quot;&gt;&lt;span class=&quot;date&quot;&gt;12:00:00 AM 02/03/2009&lt;/span&gt;&lt;/span&gt;
&lt;span class=&quot;desc&quot;&gt;&lt;br /&gt;&lt;/span&gt;
&lt;/div&gt;

&lt;div class=&quot;changelog&quot;&gt;


Import of 2009-02-03.mdwn&lt;br /&gt;


&lt;/div&gt;



	</content>



</entry>
<entry>
	<title>change to posts/2009-01-28 on Rog&#xE9;rio Brito&#x27;s Digital Junkyard</title>

	<id>/blog/recentchanges/change_fd3da3fe34725594a1b6fc03458f67e3347aae5a/</id>

	<link href="/blog/recentchanges/#change-fd3da3fe34725594a1b6fc03458f67e3347aae5a"/>

	<author><name>rbrito</name></author>





	<updated>2009-01-28T02:00:00Z</updated>
	<published>2009-01-28T02:00:00Z</published>

	<content type="html" xml:lang="en">
	





&lt;div id=&quot;change-fd3da3fe34725594a1b6fc03458f67e3347aae5a&quot; class=&quot;metadata&quot;&gt;
&lt;span class=&quot;desc&quot;&gt;&lt;br /&gt;Changed pages:&lt;/span&gt;
&lt;span class=&quot;pagelinks&quot;&gt;

posts/2009-01-28

&lt;/span&gt;
&lt;span class=&quot;desc&quot;&gt;&lt;br /&gt;Changed by:&lt;/span&gt;
&lt;span class=&quot;committer&quot;&gt;

rbrito

&lt;/span&gt;
&lt;span class=&quot;desc&quot;&gt;&lt;br /&gt;Commit type:&lt;/span&gt;
&lt;span class=&quot;committype&quot;&gt;git&lt;/span&gt;
&lt;span class=&quot;desc&quot;&gt;&lt;br /&gt;Date:&lt;/span&gt;
&lt;span class=&quot;changedate&quot;&gt;&lt;span class=&quot;date&quot;&gt;12:00:00 AM 01/28/2009&lt;/span&gt;&lt;/span&gt;
&lt;span class=&quot;desc&quot;&gt;&lt;br /&gt;&lt;/span&gt;
&lt;/div&gt;

&lt;div class=&quot;changelog&quot;&gt;


Import of 2009-01-28.mdwn&lt;br /&gt;


&lt;/div&gt;



	</content>



</entry>
<entry>
	<title>change to posts/2008-12-17 on Rog&#xE9;rio Brito&#x27;s Digital Junkyard</title>

	<id>/blog/recentchanges/change_79959bb8abd94b443adf397cde01dd89a48adfc1/</id>

	<link href="/blog/recentchanges/#change-79959bb8abd94b443adf397cde01dd89a48adfc1"/>

	<author><name>rbrito</name></author>





	<updated>2008-12-17T02:00:00Z</updated>
	<published>2008-12-17T02:00:00Z</published>

	<content type="html" xml:lang="en">
	





&lt;div id=&quot;change-79959bb8abd94b443adf397cde01dd89a48adfc1&quot; class=&quot;metadata&quot;&gt;
&lt;span class=&quot;desc&quot;&gt;&lt;br /&gt;Changed pages:&lt;/span&gt;
&lt;span class=&quot;pagelinks&quot;&gt;

posts/2008-12-17

&lt;/span&gt;
&lt;span class=&quot;desc&quot;&gt;&lt;br /&gt;Changed by:&lt;/span&gt;
&lt;span class=&quot;committer&quot;&gt;

rbrito

&lt;/span&gt;
&lt;span class=&quot;desc&quot;&gt;&lt;br /&gt;Commit type:&lt;/span&gt;
&lt;span class=&quot;committype&quot;&gt;git&lt;/span&gt;
&lt;span class=&quot;desc&quot;&gt;&lt;br /&gt;Date:&lt;/span&gt;
&lt;span class=&quot;changedate&quot;&gt;&lt;span class=&quot;date&quot;&gt;12:00:00 AM 12/17/2008&lt;/span&gt;&lt;/span&gt;
&lt;span class=&quot;desc&quot;&gt;&lt;br /&gt;&lt;/span&gt;
&lt;/div&gt;

&lt;div class=&quot;changelog&quot;&gt;


Import of 2008-12-17.mdwn&lt;br /&gt;


&lt;/div&gt;



	</content>



</entry>
<entry>
	<title>change to posts/2008-12-16 on Rog&#xE9;rio Brito&#x27;s Digital Junkyard</title>

	<id>/blog/recentchanges/change_aecfda2235aeda026ded497b2316bb54e8626868/</id>

	<link href="/blog/recentchanges/#change-aecfda2235aeda026ded497b2316bb54e8626868"/>

	<author><name>rbrito</name></author>





	<updated>2008-12-16T02:00:00Z</updated>
	<published>2008-12-16T02:00:00Z</published>

	<content type="html" xml:lang="en">
	





&lt;div id=&quot;change-aecfda2235aeda026ded497b2316bb54e8626868&quot; class=&quot;metadata&quot;&gt;
&lt;span class=&quot;desc&quot;&gt;&lt;br /&gt;Changed pages:&lt;/span&gt;
&lt;span class=&quot;pagelinks&quot;&gt;

posts/2008-12-16

&lt;/span&gt;
&lt;span class=&quot;desc&quot;&gt;&lt;br /&gt;Changed by:&lt;/span&gt;
&lt;span class=&quot;committer&quot;&gt;

rbrito

&lt;/span&gt;
&lt;span class=&quot;desc&quot;&gt;&lt;br /&gt;Commit type:&lt;/span&gt;
&lt;span class=&quot;committype&quot;&gt;git&lt;/span&gt;
&lt;span class=&quot;desc&quot;&gt;&lt;br /&gt;Date:&lt;/span&gt;
&lt;span class=&quot;changedate&quot;&gt;&lt;span class=&quot;date&quot;&gt;12:00:00 AM 12/16/2008&lt;/span&gt;&lt;/span&gt;
&lt;span class=&quot;desc&quot;&gt;&lt;br /&gt;&lt;/span&gt;
&lt;/div&gt;

&lt;div class=&quot;changelog&quot;&gt;


Import of 2008-12-16.mdwn&lt;br /&gt;


&lt;/div&gt;



	</content>



</entry>
<entry>
	<title>change to posts/2008-12-08 on Rog&#xE9;rio Brito&#x27;s Digital Junkyard</title>

	<id>/blog/recentchanges/change_ab29795c9022d9944605b7be412f07ad96b52f68/</id>

	<link href="/blog/recentchanges/#change-ab29795c9022d9944605b7be412f07ad96b52f68"/>

	<author><name>rbrito</name></author>





	<updated>2008-12-08T02:00:00Z</updated>
	<published>2008-12-08T02:00:00Z</published>

	<content type="html" xml:lang="en">
	





&lt;div id=&quot;change-ab29795c9022d9944605b7be412f07ad96b52f68&quot; class=&quot;metadata&quot;&gt;
&lt;span class=&quot;desc&quot;&gt;&lt;br /&gt;Changed pages:&lt;/span&gt;
&lt;span class=&quot;pagelinks&quot;&gt;

posts/2008-12-08

&lt;/span&gt;
&lt;span class=&quot;desc&quot;&gt;&lt;br /&gt;Changed by:&lt;/span&gt;
&lt;span class=&quot;committer&quot;&gt;

rbrito

&lt;/span&gt;
&lt;span class=&quot;desc&quot;&gt;&lt;br /&gt;Commit type:&lt;/span&gt;
&lt;span class=&quot;committype&quot;&gt;git&lt;/span&gt;
&lt;span class=&quot;desc&quot;&gt;&lt;br /&gt;Date:&lt;/span&gt;
&lt;span class=&quot;changedate&quot;&gt;&lt;span class=&quot;date&quot;&gt;12:00:00 AM 12/08/2008&lt;/span&gt;&lt;/span&gt;
&lt;span class=&quot;desc&quot;&gt;&lt;br /&gt;&lt;/span&gt;
&lt;/div&gt;

&lt;div class=&quot;changelog&quot;&gt;


Import of 2008-12-08.mdwn&lt;br /&gt;


&lt;/div&gt;



	</content>



</entry>
<entry>
	<title>change to posts/2008-12-03 on Rog&#xE9;rio Brito&#x27;s Digital Junkyard</title>

	<id>/blog/recentchanges/change_8ee1448dbc241615ee8077f9090f90aea9344253/</id>

	<link href="/blog/recentchanges/#change-8ee1448dbc241615ee8077f9090f90aea9344253"/>

	<author><name>rbrito</name></author>





	<updated>2008-12-03T02:00:00Z</updated>
	<published>2008-12-03T02:00:00Z</published>

	<content type="html" xml:lang="en">
	





&lt;div id=&quot;change-8ee1448dbc241615ee8077f9090f90aea9344253&quot; class=&quot;metadata&quot;&gt;
&lt;span class=&quot;desc&quot;&gt;&lt;br /&gt;Changed pages:&lt;/span&gt;
&lt;span class=&quot;pagelinks&quot;&gt;

posts/2008-12-03

&lt;/span&gt;
&lt;span class=&quot;desc&quot;&gt;&lt;br /&gt;Changed by:&lt;/span&gt;
&lt;span class=&quot;committer&quot;&gt;

rbrito

&lt;/span&gt;
&lt;span class=&quot;desc&quot;&gt;&lt;br /&gt;Commit type:&lt;/span&gt;
&lt;span class=&quot;committype&quot;&gt;git&lt;/span&gt;
&lt;span class=&quot;desc&quot;&gt;&lt;br /&gt;Date:&lt;/span&gt;
&lt;span class=&quot;changedate&quot;&gt;&lt;span class=&quot;date&quot;&gt;12:00:00 AM 12/03/2008&lt;/span&gt;&lt;/span&gt;
&lt;span class=&quot;desc&quot;&gt;&lt;br /&gt;&lt;/span&gt;
&lt;/div&gt;

&lt;div class=&quot;changelog&quot;&gt;


Import of 2008-12-03.mdwn&lt;br /&gt;


&lt;/div&gt;



	</content>



</entry>
<entry>
	<title>change to posts/2008-11-13 on Rog&#xE9;rio Brito&#x27;s Digital Junkyard</title>

	<id>/blog/recentchanges/change_64890adb12ca03ef42dbcf10680f4352383fbccd/</id>

	<link href="/blog/recentchanges/#change-64890adb12ca03ef42dbcf10680f4352383fbccd"/>

	<author><name>rbrito</name></author>





	<updated>2008-11-13T02:00:00Z</updated>
	<published>2008-11-13T02:00:00Z</published>

	<content type="html" xml:lang="en">
	





&lt;div id=&quot;change-64890adb12ca03ef42dbcf10680f4352383fbccd&quot; class=&quot;metadata&quot;&gt;
&lt;span class=&quot;desc&quot;&gt;&lt;br /&gt;Changed pages:&lt;/span&gt;
&lt;span class=&quot;pagelinks&quot;&gt;

posts/2008-11-13

&lt;/span&gt;
&lt;span class=&quot;desc&quot;&gt;&lt;br /&gt;Changed by:&lt;/span&gt;
&lt;span class=&quot;committer&quot;&gt;

rbrito

&lt;/span&gt;
&lt;span class=&quot;desc&quot;&gt;&lt;br /&gt;Commit type:&lt;/span&gt;
&lt;span class=&quot;committype&quot;&gt;git&lt;/span&gt;
&lt;span class=&quot;desc&quot;&gt;&lt;br /&gt;Date:&lt;/span&gt;
&lt;span class=&quot;changedate&quot;&gt;&lt;span class=&quot;date&quot;&gt;12:00:00 AM 11/13/2008&lt;/span&gt;&lt;/span&gt;
&lt;span class=&quot;desc&quot;&gt;&lt;br /&gt;&lt;/span&gt;
&lt;/div&gt;

&lt;div class=&quot;changelog&quot;&gt;


Import of 2008-11-13.mdwn&lt;br /&gt;


&lt;/div&gt;



	</content>



</entry>
<entry>
	<title>change to posts/2008-10-12 on Rog&#xE9;rio Brito&#x27;s Digital Junkyard</title>

	<id>/blog/recentchanges/change_e2f23fd8c01fa1e268da0bd69ba862d8c4ee5888/</id>

	<link href="/blog/recentchanges/#change-e2f23fd8c01fa1e268da0bd69ba862d8c4ee5888"/>

	<author><name>rbrito</name></author>





	<updated>2008-10-12T03:00:00Z</updated>
	<published>2008-10-12T03:00:00Z</published>

	<content type="html" xml:lang="en">
	





&lt;div id=&quot;change-e2f23fd8c01fa1e268da0bd69ba862d8c4ee5888&quot; class=&quot;metadata&quot;&gt;
&lt;span class=&quot;desc&quot;&gt;&lt;br /&gt;Changed pages:&lt;/span&gt;
&lt;span class=&quot;pagelinks&quot;&gt;

posts/2008-10-12

&lt;/span&gt;
&lt;span class=&quot;desc&quot;&gt;&lt;br /&gt;Changed by:&lt;/span&gt;
&lt;span class=&quot;committer&quot;&gt;

rbrito

&lt;/span&gt;
&lt;span class=&quot;desc&quot;&gt;&lt;br /&gt;Commit type:&lt;/span&gt;
&lt;span class=&quot;committype&quot;&gt;git&lt;/span&gt;
&lt;span class=&quot;desc&quot;&gt;&lt;br /&gt;Date:&lt;/span&gt;
&lt;span class=&quot;changedate&quot;&gt;&lt;span class=&quot;date&quot;&gt;12:00:00 AM 10/12/2008&lt;/span&gt;&lt;/span&gt;
&lt;span class=&quot;desc&quot;&gt;&lt;br /&gt;&lt;/span&gt;
&lt;/div&gt;

&lt;div class=&quot;changelog&quot;&gt;


Import of 2008-10-12.mdwn&lt;br /&gt;


&lt;/div&gt;



	</content>



</entry>
<entry>
	<title>change to posts/2008-09-24 on Rog&#xE9;rio Brito&#x27;s Digital Junkyard</title>

	<id>/blog/recentchanges/change_022c1ccac51771108230eda3c7de747c85fa06d5/</id>

	<link href="/blog/recentchanges/#change-022c1ccac51771108230eda3c7de747c85fa06d5"/>

	<author><name>rbrito</name></author>





	<updated>2008-09-24T03:00:00Z</updated>
	<published>2008-09-24T03:00:00Z</published>

	<content type="html" xml:lang="en">
	





&lt;div id=&quot;change-022c1ccac51771108230eda3c7de747c85fa06d5&quot; class=&quot;metadata&quot;&gt;
&lt;span class=&quot;desc&quot;&gt;&lt;br /&gt;Changed pages:&lt;/span&gt;
&lt;span class=&quot;pagelinks&quot;&gt;

posts/2008-09-24

&lt;/span&gt;
&lt;span class=&quot;desc&quot;&gt;&lt;br /&gt;Changed by:&lt;/span&gt;
&lt;span class=&quot;committer&quot;&gt;

rbrito

&lt;/span&gt;
&lt;span class=&quot;desc&quot;&gt;&lt;br /&gt;Commit type:&lt;/span&gt;
&lt;span class=&quot;committype&quot;&gt;git&lt;/span&gt;
&lt;span class=&quot;desc&quot;&gt;&lt;br /&gt;Date:&lt;/span&gt;
&lt;span class=&quot;changedate&quot;&gt;&lt;span class=&quot;date&quot;&gt;12:00:00 AM 09/24/2008&lt;/span&gt;&lt;/span&gt;
&lt;span class=&quot;desc&quot;&gt;&lt;br /&gt;&lt;/span&gt;
&lt;/div&gt;

&lt;div class=&quot;changelog&quot;&gt;


Import of 2008-09-24.mdwn&lt;br /&gt;


&lt;/div&gt;



	</content>



</entry>
<entry>
	<title>change to posts/2008-09-23 on Rog&#xE9;rio Brito&#x27;s Digital Junkyard</title>

	<id>/blog/recentchanges/change_ae94cef19be90bd43a3b1c33bb975dbe545569ca/</id>

	<link href="/blog/recentchanges/#change-ae94cef19be90bd43a3b1c33bb975dbe545569ca"/>

	<author><name>rbrito</name></author>





	<updated>2008-09-23T03:00:00Z</updated>
	<published>2008-09-23T03:00:00Z</published>

	<content type="html" xml:lang="en">
	





&lt;div id=&quot;change-ae94cef19be90bd43a3b1c33bb975dbe545569ca&quot; class=&quot;metadata&quot;&gt;
&lt;span class=&quot;desc&quot;&gt;&lt;br /&gt;Changed pages:&lt;/span&gt;
&lt;span class=&quot;pagelinks&quot;&gt;

posts/2008-09-23

&lt;/span&gt;
&lt;span class=&quot;desc&quot;&gt;&lt;br /&gt;Changed by:&lt;/span&gt;
&lt;span class=&quot;committer&quot;&gt;

rbrito

&lt;/span&gt;
&lt;span class=&quot;desc&quot;&gt;&lt;br /&gt;Commit type:&lt;/span&gt;
&lt;span class=&quot;committype&quot;&gt;git&lt;/span&gt;
&lt;span class=&quot;desc&quot;&gt;&lt;br /&gt;Date:&lt;/span&gt;
&lt;span class=&quot;changedate&quot;&gt;&lt;span class=&quot;date&quot;&gt;12:00:00 AM 09/23/2008&lt;/span&gt;&lt;/span&gt;
&lt;span class=&quot;desc&quot;&gt;&lt;br /&gt;&lt;/span&gt;
&lt;/div&gt;

&lt;div class=&quot;changelog&quot;&gt;


Import of 2008-09-23.mdwn&lt;br /&gt;


&lt;/div&gt;



	</content>



</entry>
<entry>
	<title>change to posts/2008-09-19 on Rog&#xE9;rio Brito&#x27;s Digital Junkyard</title>

	<id>/blog/recentchanges/change_6ea3ff5e598ce32ca3692da2ec9e32110c01ec0b/</id>

	<link href="/blog/recentchanges/#change-6ea3ff5e598ce32ca3692da2ec9e32110c01ec0b"/>

	<author><name>rbrito</name></author>





	<updated>2008-09-19T03:00:00Z</updated>
	<published>2008-09-19T03:00:00Z</published>

	<content type="html" xml:lang="en">
	





&lt;div id=&quot;change-6ea3ff5e598ce32ca3692da2ec9e32110c01ec0b&quot; class=&quot;metadata&quot;&gt;
&lt;span class=&quot;desc&quot;&gt;&lt;br /&gt;Changed pages:&lt;/span&gt;
&lt;span class=&quot;pagelinks&quot;&gt;

posts/2008-09-19

&lt;/span&gt;
&lt;span class=&quot;desc&quot;&gt;&lt;br /&gt;Changed by:&lt;/span&gt;
&lt;span class=&quot;committer&quot;&gt;

rbrito

&lt;/span&gt;
&lt;span class=&quot;desc&quot;&gt;&lt;br /&gt;Commit type:&lt;/span&gt;
&lt;span class=&quot;committype&quot;&gt;git&lt;/span&gt;
&lt;span class=&quot;desc&quot;&gt;&lt;br /&gt;Date:&lt;/span&gt;
&lt;span class=&quot;changedate&quot;&gt;&lt;span class=&quot;date&quot;&gt;12:00:00 AM 09/19/2008&lt;/span&gt;&lt;/span&gt;
&lt;span class=&quot;desc&quot;&gt;&lt;br /&gt;&lt;/span&gt;
&lt;/div&gt;

&lt;div class=&quot;changelog&quot;&gt;


Import of 2008-09-19.mdwn&lt;br /&gt;


&lt;/div&gt;



	</content>



</entry>
<entry>
	<title>change to posts/2008-09-14 on Rog&#xE9;rio Brito&#x27;s Digital Junkyard</title>

	<id>/blog/recentchanges/change_dff387f608a8a82d50b653314cf5056bfe401cac/</id>

	<link href="/blog/recentchanges/#change-dff387f608a8a82d50b653314cf5056bfe401cac"/>

	<author><name>rbrito</name></author>





	<updated>2008-09-14T03:00:00Z</updated>
	<published>2008-09-14T03:00:00Z</published>

	<content type="html" xml:lang="en">
	





&lt;div id=&quot;change-dff387f608a8a82d50b653314cf5056bfe401cac&quot; class=&quot;metadata&quot;&gt;
&lt;span class=&quot;desc&quot;&gt;&lt;br /&gt;Changed pages:&lt;/span&gt;
&lt;span class=&quot;pagelinks&quot;&gt;

posts/2008-09-14

&lt;/span&gt;
&lt;span class=&quot;desc&quot;&gt;&lt;br /&gt;Changed by:&lt;/span&gt;
&lt;span class=&quot;committer&quot;&gt;

rbrito

&lt;/span&gt;
&lt;span class=&quot;desc&quot;&gt;&lt;br /&gt;Commit type:&lt;/span&gt;
&lt;span class=&quot;committype&quot;&gt;git&lt;/span&gt;
&lt;span class=&quot;desc&quot;&gt;&lt;br /&gt;Date:&lt;/span&gt;
&lt;span class=&quot;changedate&quot;&gt;&lt;span class=&quot;date&quot;&gt;12:00:00 AM 09/14/2008&lt;/span&gt;&lt;/span&gt;
&lt;span class=&quot;desc&quot;&gt;&lt;br /&gt;&lt;/span&gt;
&lt;/div&gt;

&lt;div class=&quot;changelog&quot;&gt;


Import of 2008-09-14.mdwn&lt;br /&gt;


&lt;/div&gt;



	</content>



</entry>
<entry>
	<title>change to posts/2008-09-13 on Rog&#xE9;rio Brito&#x27;s Digital Junkyard</title>

	<id>/blog/recentchanges/change_60ba0a589af74c8d92ed9efca5a078d3dd945e50/</id>

	<link href="/blog/recentchanges/#change-60ba0a589af74c8d92ed9efca5a078d3dd945e50"/>

	<author><name>rbrito</name></author>





	<updated>2008-09-13T03:00:00Z</updated>
	<published>2008-09-13T03:00:00Z</published>

	<content type="html" xml:lang="en">
	





&lt;div id=&quot;change-60ba0a589af74c8d92ed9efca5a078d3dd945e50&quot; class=&quot;metadata&quot;&gt;
&lt;span class=&quot;desc&quot;&gt;&lt;br /&gt;Changed pages:&lt;/span&gt;
&lt;span class=&quot;pagelinks&quot;&gt;

posts/2008-09-13

&lt;/span&gt;
&lt;span class=&quot;desc&quot;&gt;&lt;br /&gt;Changed by:&lt;/span&gt;
&lt;span class=&quot;committer&quot;&gt;

rbrito

&lt;/span&gt;
&lt;span class=&quot;desc&quot;&gt;&lt;br /&gt;Commit type:&lt;/span&gt;
&lt;span class=&quot;committype&quot;&gt;git&lt;/span&gt;
&lt;span class=&quot;desc&quot;&gt;&lt;br /&gt;Date:&lt;/span&gt;
&lt;span class=&quot;changedate&quot;&gt;&lt;span class=&quot;date&quot;&gt;12:00:00 AM 09/13/2008&lt;/span&gt;&lt;/span&gt;
&lt;span class=&quot;desc&quot;&gt;&lt;br /&gt;&lt;/span&gt;
&lt;/div&gt;

&lt;div class=&quot;changelog&quot;&gt;


Import of 2008-09-13.mdwn&lt;br /&gt;


&lt;/div&gt;



	</content>



</entry>
<entry>
	<title>change to posts/2008-09-04 on Rog&#xE9;rio Brito&#x27;s Digital Junkyard</title>

	<id>/blog/recentchanges/change_adb137dec2a434016296b7f357ba3e70c187325a/</id>

	<link href="/blog/recentchanges/#change-adb137dec2a434016296b7f357ba3e70c187325a"/>

	<author><name>rbrito</name></author>





	<updated>2008-09-04T03:00:00Z</updated>
	<published>2008-09-04T03:00:00Z</published>

	<content type="html" xml:lang="en">
	





&lt;div id=&quot;change-adb137dec2a434016296b7f357ba3e70c187325a&quot; class=&quot;metadata&quot;&gt;
&lt;span class=&quot;desc&quot;&gt;&lt;br /&gt;Changed pages:&lt;/span&gt;
&lt;span class=&quot;pagelinks&quot;&gt;

posts/2008-09-04

&lt;/span&gt;
&lt;span class=&quot;desc&quot;&gt;&lt;br /&gt;Changed by:&lt;/span&gt;
&lt;span class=&quot;committer&quot;&gt;

rbrito

&lt;/span&gt;
&lt;span class=&quot;desc&quot;&gt;&lt;br /&gt;Commit type:&lt;/span&gt;
&lt;span class=&quot;committype&quot;&gt;git&lt;/span&gt;
&lt;span class=&quot;desc&quot;&gt;&lt;br /&gt;Date:&lt;/span&gt;
&lt;span class=&quot;changedate&quot;&gt;&lt;span class=&quot;date&quot;&gt;12:00:00 AM 09/04/2008&lt;/span&gt;&lt;/span&gt;
&lt;span class=&quot;desc&quot;&gt;&lt;br /&gt;&lt;/span&gt;
&lt;/div&gt;

&lt;div class=&quot;changelog&quot;&gt;


Import of 2008-09-04.mdwn&lt;br /&gt;


&lt;/div&gt;



	</content>



</entry>
<entry>
	<title>change to posts/2008-08-14 on Rog&#xE9;rio Brito&#x27;s Digital Junkyard</title>

	<id>/blog/recentchanges/change_12924518198c80b96ba864d8ff5935576f97915e/</id>

	<link href="/blog/recentchanges/#change-12924518198c80b96ba864d8ff5935576f97915e"/>

	<author><name>rbrito</name></author>





	<updated>2008-08-14T03:00:00Z</updated>
	<published>2008-08-14T03:00:00Z</published>

	<content type="html" xml:lang="en">
	





&lt;div id=&quot;change-12924518198c80b96ba864d8ff5935576f97915e&quot; class=&quot;metadata&quot;&gt;
&lt;span class=&quot;desc&quot;&gt;&lt;br /&gt;Changed pages:&lt;/span&gt;
&lt;span class=&quot;pagelinks&quot;&gt;

posts/2008-08-14

&lt;/span&gt;
&lt;span class=&quot;desc&quot;&gt;&lt;br /&gt;Changed by:&lt;/span&gt;
&lt;span class=&quot;committer&quot;&gt;

rbrito

&lt;/span&gt;
&lt;span class=&quot;desc&quot;&gt;&lt;br /&gt;Commit type:&lt;/span&gt;
&lt;span class=&quot;committype&quot;&gt;git&lt;/span&gt;
&lt;span class=&quot;desc&quot;&gt;&lt;br /&gt;Date:&lt;/span&gt;
&lt;span class=&quot;changedate&quot;&gt;&lt;span class=&quot;date&quot;&gt;12:00:00 AM 08/14/2008&lt;/span&gt;&lt;/span&gt;
&lt;span class=&quot;desc&quot;&gt;&lt;br /&gt;&lt;/span&gt;
&lt;/div&gt;

&lt;div class=&quot;changelog&quot;&gt;


Import of 2008-08-14.mdwn&lt;br /&gt;


&lt;/div&gt;



	</content>



</entry>
<entry>
	<title>change to posts/2008-07-28 on Rog&#xE9;rio Brito&#x27;s Digital Junkyard</title>

	<id>/blog/recentchanges/change_0a4064c5fa1dbd6bf11c838893938e9b3722a9ba/</id>

	<link href="/blog/recentchanges/#change-0a4064c5fa1dbd6bf11c838893938e9b3722a9ba"/>

	<author><name>rbrito</name></author>





	<updated>2008-07-28T03:00:00Z</updated>
	<published>2008-07-28T03:00:00Z</published>

	<content type="html" xml:lang="en">
	





&lt;div id=&quot;change-0a4064c5fa1dbd6bf11c838893938e9b3722a9ba&quot; class=&quot;metadata&quot;&gt;
&lt;span class=&quot;desc&quot;&gt;&lt;br /&gt;Changed pages:&lt;/span&gt;
&lt;span class=&quot;pagelinks&quot;&gt;

posts/2008-07-28

&lt;/span&gt;
&lt;span class=&quot;desc&quot;&gt;&lt;br /&gt;Changed by:&lt;/span&gt;
&lt;span class=&quot;committer&quot;&gt;

rbrito

&lt;/span&gt;
&lt;span class=&quot;desc&quot;&gt;&lt;br /&gt;Commit type:&lt;/span&gt;
&lt;span class=&quot;committype&quot;&gt;git&lt;/span&gt;
&lt;span class=&quot;desc&quot;&gt;&lt;br /&gt;Date:&lt;/span&gt;
&lt;span class=&quot;changedate&quot;&gt;&lt;span class=&quot;date&quot;&gt;12:00:00 AM 07/28/2008&lt;/span&gt;&lt;/span&gt;
&lt;span class=&quot;desc&quot;&gt;&lt;br /&gt;&lt;/span&gt;
&lt;/div&gt;

&lt;div class=&quot;changelog&quot;&gt;


Import of 2008-07-28.mdwn&lt;br /&gt;


&lt;/div&gt;



	</content>



</entry>
<entry>
	<title>change to posts/2008-07-24 on Rog&#xE9;rio Brito&#x27;s Digital Junkyard</title>

	<id>/blog/recentchanges/change_d6ba3165681f494284c095264e99114805e99667/</id>

	<link href="/blog/recentchanges/#change-d6ba3165681f494284c095264e99114805e99667"/>

	<author><name>rbrito</name></author>





	<updated>2008-07-24T03:00:00Z</updated>
	<published>2008-07-24T03:00:00Z</published>

	<content type="html" xml:lang="en">
	





&lt;div id=&quot;change-d6ba3165681f494284c095264e99114805e99667&quot; class=&quot;metadata&quot;&gt;
&lt;span class=&quot;desc&quot;&gt;&lt;br /&gt;Changed pages:&lt;/span&gt;
&lt;span class=&quot;pagelinks&quot;&gt;

posts/2008-07-24

&lt;/span&gt;
&lt;span class=&quot;desc&quot;&gt;&lt;br /&gt;Changed by:&lt;/span&gt;
&lt;span class=&quot;committer&quot;&gt;

rbrito

&lt;/span&gt;
&lt;span class=&quot;desc&quot;&gt;&lt;br /&gt;Commit type:&lt;/span&gt;
